procedure_id,concept_name,concept_id,order_code,order_description,frequency,percentage,domain_id,vocabulary_id,concept_code,concept_class_id
3213561,No matching concept,0,REF110,AMB REFERRAL TO WOUND CLINIC,15376,0.03%,Metadata,None,No matching concept,Undefined
1270556,No matching concept,0,CON10,IP CONSULT TO NEUROSURGERY,15295,0.03%,Metadata,None,No matching concept,Undefined
7660658,External electrode cardioversion,4166447,CAR142,CARDIOVERSION EXTERNAL,15292,0.03%,Procedure,SNOMED,275148007,Procedure
3702466,"","",LAB11746,SPECIMEN TRACKING SHELL TEST (BH YH),15279,0.03%,"","","",""
8599088,No matching concept,0,IMG3711,INVASIVE RADIOLOGY PROCEDURE,15253,0.03%,Metadata,None,No matching concept,Undefined
1893620,No matching concept,0,IMGR07,IR RESULT SCAN,15245,0.03%,Metadata,None,No matching concept,Undefined
8275345,Insertion of amalgam restoration into tooth,4124186,WIS12,AMALGAM RESTORATION,15213,0.03%,Procedure,SNOMED,234787002,Procedure
3225456,No matching concept,0,REF17,AMB REFERRAL TO COLORECTAL SURGERY,15159,0.03%,Metadata,None,No matching concept,Undefined
3436023,Fetal biophysical profile; with non-stress testing,2211758,IMG4142,US MFM BIOPHYSICAL PROFILE W NST (PERI ONLY)(GH BH YH),15155,0.03%,Procedure,CPT4,76818,CPT4
8517058,"Magnetic resonance (eg, proton) imaging, abdomen; with contrast material(s)",2211515,IMG319,MRI ABDOMEN WO IV CONTRAST,15130,0.03%,Procedure,CPT4,74182,CPT4
8003635,"","",ADT119,ED OBS PSYCHIATRY,15103,0.03%,"","","",""
5735027,CTA Chest vessels,36303708,IMG3331,OSF CTA CHEST,15074,0.03%,Procedure,LOINC,86981-8,Clinical Observation
4383740,"","",SUP6586,SUPPLY ORDER- ADAPT HEALTH,15057,0.03%,"","","",""
5554021,No matching concept,0,NUR579,VVV  BORTEZOMIB TREATMENT CONDITIONS,15056,0.03%,Metadata,None,No matching concept,Undefined
4296645,Radionuclide ventriculography at cardiac stress,4162056,CVR20,CARDIAC NUCLEAR STRESS REPORT,14976,0.03%,Procedure,SNOMED,432155006,Procedure
4167783,Meningococcal conjugate vaccination,765468,IMM48,MENINGOCOCCAL MCV4O (MENVEO) IM,14941,0.03%,Procedure,SNOMED,428271000124109,Procedure
4684425,XR Ankle - bilateral AP and Lateral and oblique,3052795,IMG1535,XR ANKLE BILATERAL AP LATERAL AND OBLIQUE (GH BH YH YHC LM),14924,0.03%,Procedure,LOINC,36720-1,Clinical Observation
9632144,No matching concept,0,ADT19,ZZZRETIRED23 HOUR ADMIT,14922,0.03%,Metadata,None,No matching concept,Undefined
7333668,XR Hand - left PA and Lateral,3051429,IMG108,XR HAND LEFT PA AND LATERAL(BH GH YH LM WH),14908,0.03%,Procedure,LOINC,36753-2,Clinical Observation
5609300,No matching concept,0,LAB10057,EXTRA OTHER,14864,0.03%,Metadata,None,No matching concept,Undefined
9489296,Giving patient an enema,4265034,NUR333,ENEMA-SOAP SUDS,14822,0.03%,Procedure,SNOMED,61919008,Procedure
4338310,"Radiologic examination, ankle; complete, minimum of 3 views",2211488,IMG2273,XR ANKLE 3 VIEWS,14777,0.03%,Procedure,CPT4,73610,CPT4
4896384,No matching concept,0,ADT10,ZZZRETIREDPLACE IN ED OBSERVATION,14738,0.03%,Metadata,None,No matching concept,Undefined
8351859,No matching concept,0,LAB897,AEROBIC CULTURE      (L Q),14631,0.03%,Metadata,None,No matching concept,Undefined
7631456,Ultrasonography of inguinal region,4167029,IMG4570,US SOFT TISSUE INGUINAL REGION (YH LM WH BH),14580,0.03%,Procedure,SNOMED,418105000,Procedure
1028385,Transthoracic echocardiography for congenital cardiac anomalies; follow-up or limited study,2313868,ECH117,PEDI ECHO 2D LTD CONG ANOMALY W DOPPLER AND CFI IF INDICATED 3D,14574,0.03%,Procedure,CPT4,93304,CPT4
5469508,"Magnetic resonance (eg, proton) imaging, pelvis; without contrast material(s)",2211426,IMG289,MRI PELVIS WO IV CONTRAST,14556,0.03%,Procedure,CPT4,72195,CPT4
8635650,No matching concept,0,CON101,IP CONSULT TO CASE MANAGEMENT,14552,0.03%,Metadata,None,No matching concept,Undefined
3475822,No matching concept,0,SUP6522,SUPPLY ORDER- YALE SURGICAL,14483,0.03%,Metadata,None,No matching concept,Undefined
3057710,"Radiologic examination, spine; thoracolumbar junction, minimum of 2 views",2211395,IMG64,XR THORACOLUMBAR SPINE AP LATERAL,14477,0.03%,Procedure,CPT4,72080,CPT4
8962957,No matching concept,0,CAR84,DEVICE INTERROGATION REMOTE NON BILLABLE,14465,0.03%,Metadata,None,No matching concept,Undefined
9371281,Vacuum assisted excision of lesion of breast using stereotactic X-ray guidance,36714376,IMG2213,MAMMO STEREOTACTIC BREAST BIOPSY VACUUM ASSISTED LEFT,14381,0.03%,Procedure,SNOMED,719573001,Procedure
8230005,No matching concept,0,DIET58,DIET TUBE FEED WITH TRAY,14362,0.03%,Metadata,None,No matching concept,Undefined
2522130,No matching concept,0,REF120,AMB REFERRAL TO PEDIATRIC SLEEP MEDICINE,14353,0.03%,Metadata,None,No matching concept,Undefined
6949710,No matching concept,0,ADT188,ED PSYCH EVALUATION START,14317,0.03%,Metadata,None,No matching concept,Undefined
6954048,Duplex scan of lower extremity arteries or arterial bypass grafts; unilateral or limited study,2313986,IMG1657,US DUPLEX LOWER EXTREMITY ARTERIES LEFT,14315,0.03%,Procedure,CPT4,93926,CPT4
9112153,No matching concept,0,IMG3016,IR GASTROINTESTINAL PROCEDURES,14305,0.03%,Metadata,None,No matching concept,Undefined
3443302,Esophageal motility study,40437253,SLP5,SLP MODIFIED BARIUM SWALLOW,14282,0.03%,Procedure,SNOMED,241148006,Procedure
6608245,No matching concept,0,NUR2929,ENROLL PATIENT TO WARFARIN DOSE ADJUSTMENT (AMBULATORY) PROTOCOL,14262,0.03%,Metadata,None,No matching concept,Undefined
2934499,No matching concept,0,IMG4420,CASE REQUEST LMH INTERVENTIONAL RADIOLOGY,14239,0.03%,Metadata,None,No matching concept,Undefined
9031656,No matching concept,0,LAB4052,RAPID STREP A ANTIGEN      (GH),14223,0.03%,Metadata,None,No matching concept,Undefined
5093758,No matching concept,0,REF111,AMB REFERRAL TO ANTICOAGULATION MONITORING,14187,0.03%,Metadata,None,No matching concept,Undefined
4427033,Mammography of left breast specimen,37207414,IMG2190,MAMMO BREAST SPECIMEN LEFT BX IN OR(GH YH BH LM),14180,0.03%,Procedure,SNOMED,12821000087102,Procedure
3543405,No matching concept,0,EP94,CASE REQUEST EP (BH),14130,0.03%,Metadata,None,No matching concept,Undefined
7586363,No matching concept,0,N0196,NEMG ATU,14128,0.03%,Metadata,None,No matching concept,Undefined
9131909,Coronavirus vaccination,4236188,IMM217,COVID-19 PFIZER  12 YRS+  TRIS  0.3 ML,14127,0.03%,Procedure,SNOMED,90640007,Procedure
6725572,Administration of influenza vaccine,4313306,IMM98,INFLUENZA  QUADRIVALENT  WITH PRESERVATIVE (36 MO+),14096,0.03%,Procedure,SNOMED,86198006,Procedure
4891436,No matching concept,0,LAB4736,SPECIMEN TO CYTOLOGY     (BH YH),14087,0.03%,Metadata,None,No matching concept,Undefined
6772244,No matching concept,0,NUR1253,ADMINISTER RHOGAM,14060,0.03%,Metadata,None,No matching concept,Undefined
4639681,MRI of pelvis,4097527,IMG3395,OSF MRI PELVIS,14017,0.03%,Procedure,SNOMED,2690005,Procedure
7395626,"Computed tomography, pelvis; without contrast material",2211423,IMG217,CT PELVIS WO IV CONTRAST,13994,0.03%,Procedure,CPT4,72192,CPT4
7369901,Removal of suture,4147691,PRO95,SUTURE REMOVAL,13979,0.03%,Procedure,SNOMED,30549001,Procedure
5876243,No matching concept,0,ADT109,YNH PSYCH BED HOLD,13971,0.03%,Metadata,None,No matching concept,Undefined
2958659,"Computed tomographic angiography, abdominal aorta and bilateral iliofemoral lower extremity runoff, with contrast material(s), including noncontrast images, if performed, and image postprocessing",2211585,IMG1663,CTA ABDOMEN WITH ILIOFEMORAL RUNOFF,13842,0.02%,Procedure,CPT4,75635,CPT4
1317038,No matching concept,0,IMG4263,HOSPITALIST PROCEDURE(YH),13820,0.02%,Metadata,None,No matching concept,Undefined
5576801,Vacuum assisted excision of lesion of breast using stereotactic X-ray guidance,36714376,IMG2214,MAMMO STEREOTACTIC BREAST BIOPSY VACUUM ASSISTED RIGHT,13814,0.02%,Procedure,SNOMED,719573001,Procedure
1872366,No matching concept,0,IMM146,DTAP IPV HIB HEPB,13806,0.02%,Metadata,None,No matching concept,Undefined
8927360,No matching concept,0,LAB5514,SPECIAL PROCEDURES SCAN,13795,0.02%,Metadata,None,No matching concept,Undefined
7459710,No matching concept,0,OPH32,IOL MASTER - OU - BOTH EYES,13795,0.02%,Metadata,None,No matching concept,Undefined
4870345,MRI of right foot,37109209,IMG1390,MRI FOOT RIGHT WO IV CONTRAST,13780,0.02%,Procedure,SNOMED,2291000087100,Procedure
8030059,Ultrasonography of abdominal wall,3655699,IMG4188,US ABDOMINAL WALL (GH YH LM WH),13779,0.02%,Procedure,SNOMED,866202009,Procedure
7232714,Education about child car seat safety,40483552,NUR31,CAR SEAT CHALLENGE TEST,13712,0.02%,Procedure,SNOMED,442451005,Procedure
8277335,No matching concept,0,BHS20,RESTRICT  CLOTHING (PSYCH),13697,0.02%,Metadata,None,No matching concept,Undefined
8004881,"Computed tomography, soft tissue neck; without contrast material followed by contrast material(s) and further sections",2211338,IMG1254,MRI NECK SOFT TISSUE W WO IV CONTRAST,13688,0.02%,Procedure,CPT4,70492,CPT4
3774251,No matching concept,0,LAB3440,ZZZRESPIRATORY VIRUS DFA     (GH LMW YH),13682,0.02%,Metadata,None,No matching concept,Undefined
4013569,Mammography of right breast specimen,37207415,IMG2191,MAMMO BREAST SPECIMEN RIGHT BX IN OR(GH YH BH LM),13663,0.02%,Procedure,SNOMED,12831000087100,Procedure
8207906,No matching concept,0,IMG3206,XR IMPORT OUTSIDE IMAGES,13597,0.02%,Metadata,None,No matching concept,Undefined
1257766,No matching concept,0,IMG381,NM HEPATOBILIARY,13587,0.02%,Metadata,None,No matching concept,Undefined
7617561,No matching concept,0,LAB9034,ZZZCELL COUNT CSF  TUBE 4     (YH),13547,0.02%,Metadata,None,No matching concept,Undefined
5786377,"CT of abdominal organs, kidney, ureter and bladder without contrast",37109323,IMG4548,CT FLANK PAIN (UNDIFFERENTIATED  POSSIBLE KIDNEY STONE) YH,13527,0.02%,Procedure,SNOMED,411011000119106,Procedure
2388596,"Radiologic examination, sinuses, paranasal, complete, minimum of 3 views",2211307,IMG19,XR SINUSES 3 + VW,13505,0.02%,Procedure,CPT4,70220,CPT4
2653155,No matching concept,0,IMG4400,OUTSIDE INTERPRETATION CT NEURO,13450,0.02%,Metadata,None,No matching concept,Undefined
5193697,Fetal biophysical profile; without non-stress testing,2211759,IMG540,US FETAL BIOPHYSICAL PROFILE WO NON STRESS TESTING (GH YHC LM),13427,0.02%,Procedure,CPT4,76819,CPT4
6646346,"Photopheresis, extracorporeal",2108168,PRO52,PHOTOPHERESIS,13413,0.02%,Procedure,CPT4,36522,CPT4
6106261,Lumbar puncture,4080549,PRO88,LUMBAR PUNCTURE,13408,0.02%,Procedure,SNOMED,277762005,Procedure
9655745,Airborne precautions,4252705,ISO4,AIRBORNE ISOLATION STATUS,13384,0.02%,Procedure,SNOMED,409524006,Procedure
2195469,CT of cervical spine,4086261,IMG3314,OSF CT CERVICAL SPINE,13372,0.02%,Procedure,SNOMED,241578008,Procedure
5583393,"Physical therapy evaluation/treatment, per visit",40217448,PT5,PT EVALUATION,13337,0.02%,Procedure,HCPCS,Q0086,HCPCS
8313917,CT of abdomen,4061009,IMG3310,OSF CT ABDOMEN,13291,0.02%,Procedure,SNOMED,169070004,Procedure
5641562,No matching concept,0,IMG3291,OSF UPPER EXTREMITY LEFT,13230,0.02%,Metadata,None,No matching concept,Undefined
5300933,No matching concept,0,REF92,AMB REFERRAL TO PSYCHOLOGY,13157,0.02%,Metadata,None,No matching concept,Undefined
8104952,No matching concept,0,CON59,IP CONSULT TO DERMATOLOGY,13153,0.02%,Metadata,None,No matching concept,Undefined
1844609,No matching concept,0,NUR579,BH  HOLD PARAMETER,13116,0.02%,Metadata,None,No matching concept,Undefined
3276582,No matching concept,0,RT218,SPONTANEOUS CPAP  VENTILATOR (ADULT),13087,0.02%,Metadata,None,No matching concept,Undefined
3304494,Noninvasive ventilation,4177224,RT28,CPAP (NIV) (ADULT),13078,0.02%,Procedure,SNOMED,428311008,Procedure
2310596,"","",POC223,POCT URINALYSIS 10SG (YALE NEW HAVEN URGENT CARE),13078,0.02%,"","","",""
6409012,No matching concept,0,REF131,AMB REFERRAL TO COMPREHENSIVE HEART FAILURE,13070,0.02%,Metadata,None,No matching concept,Undefined
3238694,MRI of left hip,37109219,IMG1410,MRI HIP LEFT WO IV CONTRAST,13062,0.02%,Procedure,SNOMED,2391000087105,Procedure
1784534,No matching concept,0,REF263,AMB REFERRAL TO ADULT ONCOLOGY NUTRITION,13029,0.02%,Metadata,None,No matching concept,Undefined
5496151,No matching concept,0,PFT150,PFT (ASSOC IN PULM SLEEP MEDICINE ONLY),13017,0.02%,Metadata,None,No matching concept,Undefined
4771456,No matching concept,0,PHA4,WARFARIN  PHARMACY TO DOSE,12939,0.02%,Metadata,None,No matching concept,Undefined
3018828,No matching concept,0,LAB9357,MRSA SAUR BLOOD PCR (LAB ORDERABLE ONLY)(BH LMH YH),12934,0.02%,Metadata,None,No matching concept,Undefined
5656458,"Dual-energy X-ray absorptiometry (DXA), bone density study, 1 or more sites; appendicular skeleton (peripheral) (eg, radius, wrist, heel)",2211827,IMG2224,DEXA BONE DENSITY BILATERAL WRIST,12905,0.02%,Procedure,CPT4,77081,CPT4
7278731,No matching concept,0,REF177,AMB REFERRAL TO PALLIATIVE CARE,12880,0.02%,Metadata,None,No matching concept,Undefined
7202966,"Magnetic resonance (eg, proton) imaging, brain (including brain stem); without contrast material, followed by contrast material(s) and further sequences",2211353,IMG1255,MRI ORBITS W WO IV CONTRAST,12860,0.02%,Procedure,CPT4,70553,CPT4
2300695,No matching concept,0,LAB9374,INFLUENZA A B BY PCR     (BH GH YH),12851,0.02%,Metadata,None,No matching concept,Undefined
2472748,X-ray of both feet,4140283,IMG1537,XR FOOT BILATERAL AP AND LATERAL (GH BH YH LM),12807,0.02%,Procedure,SNOMED,426581005,Procedure
9881308,"Computed tomography, pelvis; with contrast material(s)",2211424,IMG218,CT PELVIS W  IV CONTRAST,12777,0.02%,Procedure,CPT4,72193,CPT4
8425848,No matching concept,0,IMG3290,OSF UPPER EXTREMITY RIGHT,12761,0.02%,Metadata,None,No matching concept,Undefined
6530914,No matching concept,0,IMM2135,COVID-19 PFIZER (5-11Y) 2ND DOSE GENERIC VACCINE ORDER,12755,0.02%,Metadata,None,No matching concept,Undefined
3703385,No matching concept,0,NUR1044,ORTHO EQUIP FOOT AND ANKLE,12710,0.02%,Metadata,None,No matching concept,Undefined
2108372,Magnetic resonance imaging for measurement of brain volume,44784284,IMG4028,MRI BRAIN W 3D VOLUMETRIC ANALYSIS WO IV CONTRAST (YH GH),12522,0.02%,Procedure,SNOMED,698354004,Procedure
6827579,Echography of kidney,4147846,IMG4133,URO US RENAL,12512,0.02%,Procedure,SNOMED,306005,Procedure
4478179,MRI of left foot,37117115,IMG1393,MRI FOOT LEFT WO IV CONTRAST,12510,0.02%,Procedure,SNOMED,2271000087104,Procedure
4315761,Radionuclide imaging of hepatobiliary structure using radioisotope labeled cholecystokinin,35608116,IMG1150,NM HEPATOBILIARY W CCK,12467,0.02%,Procedure,SNOMED,764975002,Procedure
5007448,No matching concept,0,LAB5555,ZZZCLOSTRIDIUM DIFFICILE TOXIN (LAB ORDERABLE ONLY)     (YH),12444,0.02%,Metadata,None,No matching concept,Undefined
1093728,Provision of overbed trapeze,4312249,NUR1014,TRAPEZE TO BED,12438,0.02%,Procedure,SNOMED,425249005,Procedure
3375272,No matching concept,0,IMG4756,FFR CT,12433,0.02%,Metadata,None,No matching concept,Undefined
4008115,Flexible fiberoptic sigmoidoscopy,4196378,GI413,SIGMOIDOSCOPY (FLEX SIG) (IMAGES),12418,0.02%,Procedure,SNOMED,44441009,Procedure
5299351,Diagnostic radiography of sacroiliac joints,4266058,IMG75,XR SACROILIAC JOINTS COMPLETE(BH GH YH LM WH),12415,0.02%,Procedure,SNOMED,6238009,Procedure
1332747,Assessment using Clinical Opiate Withdrawal Scale,35622295,NUR981,CLINICAL OPIATE WITHDRAWAL SCALE,12407,0.02%,Procedure,SNOMED,763700006,Procedure
9098739,No matching concept,0,REF31,AMB REFERRAL TO HAND SURGERY,12381,0.02%,Metadata,None,No matching concept,Undefined
1294936,No matching concept,0,NUR579,Q  DOCETAXEL TREATMENT CONDITIONS,12371,0.02%,Metadata,None,No matching concept,Undefined
2119599,"Magnetic resonance angiography, head; without contrast material(s)",2211345,IMG1593,MRI BRAIN WO IV CONTRAST INCL MRA HEAD WO IV CONTRAST,12365,0.02%,Procedure,CPT4,70544,CPT4
8256825,"Computed tomography, thoracic spine; without contrast material",2211404,IMG210,CT THORACIC SPINE WO IV CONTRAST,12350,0.02%,Procedure,CPT4,72128,CPT4
4667962,"","",APPT19,LAB APPOINTMENT REQUEST (+ - RN VISIT),12344,0.02%,"","","",""
5497278,Endoscopy,4313889,GI452,YHC ENDOSCOPY PROCEDURE,12318,0.02%,Procedure,SNOMED,423827005,Procedure
2739906,"Computed tomography, head or brain; with contrast material(s)",2211328,IMG182,CT HEAD W IV CONTRAST,12306,0.02%,Procedure,CPT4,70460,CPT4
7766067,No matching concept,0,1150014A,CARBOPLATIN TREATMENT CONDITIONS,12296,0.02%,Metadata,None,No matching concept,Undefined
6679521,Administration of inactivated poliomyelitis vaccine,36713028,IMM51,POLIOVIRUS VACCINE IPV SC IM,12184,0.02%,Procedure,SNOMED,16292771000119109,Procedure
4891865,No matching concept,0,SUP6525,SUPPLY ORDER- HANGER INC,12105,0.02%,Metadata,None,No matching concept,Undefined
3003504,No matching concept,0,LAB3828,OVA AND PARASITES  CONC AND PERM SMEAR     (LMW Q),12101,0.02%,Metadata,None,No matching concept,Undefined
3946247,No matching concept,0,LAB8448,LOWER RESP CULTURE  QUANT,12086,0.02%,Metadata,None,No matching concept,Undefined
1924051,Plain X-ray of left clavicle,42535532,IMG77,XR CLAVICLE LEFT,12066,0.02%,Procedure,SNOMED,3501000087100,Procedure
2257935,No matching concept,0,REF202,REFERRAL TO PHOTOTHERAPY  NARROW BAND UVB THERAPY,12017,0.02%,Metadata,None,No matching concept,Undefined
2780186,"Ultrasound, chest (includes mediastinum), real time with image documentation",2211738,IMG521,US CHEST,12001,0.02%,Procedure,CPT4,76604,CPT4
7059875,Bilateral mammography,4182722,IMG3947,MAMMO DIAGNOSTIC TOMO BILATERAL WO CAD (BH YH LM WH),11917,0.02%,Procedure,SNOMED,43204002,Procedure
5094072,"Computerized corneal topography, unilateral or bilateral, with interpretation and report",2313641,OPH187,CORNEAL TOPOGRAPHY - OU - BOTH EYES,11911,0.02%,Procedure,CPT4,92025,CPT4
1733410,"","",REF285,AMB REF TO AMBULATORY PHARMACY SERVICES,11906,0.02%,"","","",""
3825281,No matching concept,0,IMG4405,OUTSIDE INTERPRETATION MR ABDOMEN AND OR PELVIS,11899,0.02%,Metadata,None,No matching concept,Undefined
5005169,No matching concept,0,IMG157,XR ABD AP OBL CONE AND DECUB ERECT AND SUP W PA CHEST,11898,0.02%,Metadata,None,No matching concept,Undefined
5806870,Removal of foreign body,4032408,PRO84,FOREIGN BODY REMOVAL,11892,0.02%,Procedure,SNOMED,10849003,Procedure
9248951,"Ultrasound, pregnant uterus, real time with image documentation, transvaginal",2211757,IMG4173,US MFM PREG >14 WKS LEVEL 1 WITH TRANSVAGINAL SINGLE (BH YH LM),11874,0.02%,Procedure,CPT4,76817,CPT4
8036076,No matching concept,0,BHS23,RESTRICT SHAVE (PSYCH),11869,0.02%,Metadata,None,No matching concept,Undefined
4034732,No matching concept,0,LAB10428,CHROMOSOME ANALYSIS CHARGES (CYTOGENETICS) (YMG),11849,0.02%,Metadata,None,No matching concept,Undefined
1883275,No matching concept,0,LAB3021,GONORRHEA SDA  GENITAL     (BH),11847,0.02%,Metadata,None,No matching concept,Undefined
2322498,No matching concept,0,PFT67,PEDIATRIC PULMONARY FUNCTION TEST (BH),11842,0.02%,Metadata,None,No matching concept,Undefined
3047234,No matching concept,0,LAB2781,CHLAMYDIA SDA  GENITAL     (BH),11797,0.02%,Metadata,None,No matching concept,Undefined
3166912,No matching concept,0,NUR815,AMBU BAG AT BEDSIDE,11753,0.02%,Metadata,None,No matching concept,Undefined
5294726,No matching concept,0,IMG3222,ED PROCEDURAL ULTRASOUND PERIPHERAL VENOUS ACCESS,11750,0.02%,Metadata,None,No matching concept,Undefined
5853066,MRI of spine,4082839,IMG2719,MRI TOTAL SPINE WO IV CONTRAST(BH YH GH YHC),11710,0.02%,Procedure,SNOMED,241645008,Procedure
8701556,No matching concept,0,IMG4491,OUTSIDE INTERPRETATION PET SCAN,11710,0.02%,Metadata,None,No matching concept,Undefined
4452631,No matching concept,0,NUR547,ENCOURAGE FLUIDS,11703,0.02%,Metadata,None,No matching concept,Undefined
8242645,No matching concept,0,NUR2298,INITIATE PICC AND MIDLINE INSERTION PROTOCOL,11677,0.02%,Metadata,None,No matching concept,Undefined
8600503,"Fecal fat differential, quantitative",4269211,LAB390,FECAL FAT  QUALITATIVE     (L Q),11671,0.02%,Procedure,SNOMED,6309008,Procedure
7071392,No matching concept,0,MYC3,MYCHART BP FLOWSHEET,11651,0.02%,Metadata,None,No matching concept,Undefined
4520749,No matching concept,0,IMG4404,OUTSIDE INTERPRETATION MR NEURO,11650,0.02%,Metadata,None,No matching concept,Undefined
2630355,"Doppler velocimetry, fetal; umbilical artery",2211760,IMG4170,US MFM FOLLOW UP FETAL WITH UMBILICAL DOPPLER(BH LM YH),11634,0.02%,Procedure,CPT4,76820,CPT4
8665023,"Ultrasound, abdominal, real time with image documentation; limited (eg, single organ, quadrant, follow-up)",2211741,IMG4244,ED TRANSABDOMINAL PELVIS-PREGNANT ULTRASOUND,11560,0.02%,Procedure,CPT4,76705,CPT4
2886415,No matching concept,0,LAB2762,CG8+  I-STAT  ARTERIAL (BH LMH YH),11547,0.02%,Metadata,None,No matching concept,Undefined
1620061,"Computed tomographic angiography, head, with contrast material(s), including noncontrast images, if performed, and image postprocessing",2211339,IMG3332,OSF CTA HEAD,11538,0.02%,Procedure,CPT4,70496,CPT4
4399043,Pureed diet,763368,DIET117,DIET PUREED,11532,0.02%,Procedure,SNOMED,439121000124106,Procedure
7566901,No matching concept,0,IMG3287,OSF PELVIS,11491,0.02%,Metadata,None,No matching concept,Undefined
5338566,No matching concept,0,LAB3508,STREPTOCOCCUS PNEUMONIAE ANTIGEN  URINE,11451,0.02%,Metadata,None,No matching concept,Undefined
3298239,No matching concept,0,LAB6410,GASTROINTESTINAL PATHOLOGY     (BH YH),11445,0.02%,Metadata,None,No matching concept,Undefined
4490075,No matching concept,0,CAR83,HOLTER MONITOR - 8 TO 15 DAYS,11394,0.02%,Metadata,None,No matching concept,Undefined
5311562,No matching concept,0,NUR2216,SAGE CHLOREHEXIDINE 2% WIPE APPLY FROM NECK DOWN,11379,0.02%,Metadata,None,No matching concept,Undefined
5536570,Plain X-ray of right clavicle,42539174,IMG78,XR CLAVICLE RIGHT,11377,0.02%,Procedure,SNOMED,3511000087103,Procedure
2231800,No matching concept,0,RT226,AUTO CPAP,11366,0.02%,Metadata,None,No matching concept,Undefined
7583648,"","",IMG4575,NON OB TRANSVAGINAL,11312,0.02%,"","","",""
3736352,No matching concept,0,NUR579,AN  PEMETREXED TREATMENT CONDITIONS,11307,0.02%,Metadata,None,No matching concept,Undefined
5257932,No matching concept,0,IMG3013,IR VENOUS PROCEDURES,11306,0.02%,Metadata,None,No matching concept,Undefined
4133627,"Radiologic examination, abdomen; 3 or more views",724988,IMG2287,XR ABDOMEN AP DECUB AND LATERAL VIEW,11292,0.02%,Procedure,CPT4,74021,CPT4
9883070,No matching concept,0,LAB7451,GC AND CHLAMYDIA TMA  GENITAL     (BH),11279,0.02%,Metadata,None,No matching concept,Undefined
4852354,No matching concept,0,IMG4996,EXTERNAL OBGYN IMAGING RESULTS,11275,0.02%,Metadata,None,No matching concept,Undefined
1139289,No matching concept,0,ISO6,CONTACT AND DROPLET ISOLATION STATUS,11233,0.02%,Metadata,None,No matching concept,Undefined
9752136,Plain X-ray guided wire localization of breast lesion,4179075,IMG2203,MAMMO NEEDLE LOCALIZATION LEFT,11222,0.02%,Procedure,SNOMED,428907005,Procedure
5393367,"Computed tomography, soft tissue neck; without contrast material",2211336,IMG191,CT SOFT TISSUE NECK WO IV CONTRAST,11189,0.02%,Procedure,CPT4,70490,CPT4
8195753,Diagnostic radiography of spine with flexion and extension studies,4266360,IMG1279,XR LUMBAR SPINE FLEXION AND EXTENSION ONLY,11169,0.02%,Procedure,SNOMED,61368000,Procedure
3876700,No matching concept,0,REF69,AMB REFERRAL TO PEDIATRIC DERMATOLOGY,11061,0.02%,Metadata,None,No matching concept,Undefined
3466069,No matching concept,0,LAB2917,ANAPLASMA AND EHRLICHIA SMEAR (BH GH LMW YH),11031,0.02%,Metadata,None,No matching concept,Undefined
7005836,MRI of thoracic spine,4082988,IMG3368,OSF MRI THORACIC SPINE,11024,0.02%,Procedure,SNOMED,241647000,Procedure
7666427,No matching concept,0,LAB2971,FETAL MATERNAL HEMORRHAGE (ROSETTE)     (BH GH LMW YH),11023,0.02%,Metadata,None,No matching concept,Undefined
2672930,No matching concept,0,RT192,AEROSOL GENERATOR TITRATE (PEDIATRIC),11003,0.02%,Metadata,None,No matching concept,Undefined
8894807,No matching concept,0,LAB4095,ZZZGIARDIA AG  STOOL  EIA     (Q),10996,0.02%,Metadata,None,No matching concept,Undefined
8425034,No matching concept,0,1150046,TREATMENT RELATED VITAL SIGNS,10984,0.02%,Metadata,None,No matching concept,Undefined
2016805,PET CT Ga68 PSMA (gallium 68 prostate specific membrane antigen) imaging of cranial vertex to mid-thigh,36685475,IMG4580,PET CT SKULL TO THIGH PROSTATE PSMA (YH LM GH BH),10975,0.02%,Procedure,SNOMED,1098121000000107,Procedure
3187924,Diagnostic digital breast tomosynthesis; unilateral,46257687,IMG3948,MAMMO DIAGNOSTIC TOMO LEFT WO CAD (BH YH LM WH),10943,0.02%,Procedure,CPT4,77061,CPT4
3105591,No matching concept,0,115110,VERIFY DEXAMETHASONE INSTRUCTIONS,10930,0.02%,Metadata,None,No matching concept,Undefined
7862530,Plain X-ray of right shoulder,37207175,IMG3685,XR SHOULDER RT AP INTERNAL AP EXTERNAL LAT AXILLARY (BH YH YHC),10919,0.02%,Procedure,SNOMED,3771000087100,Procedure
5418110,Mammography of left breast,37109442,IMG608,MAMMO SCREENING LEFT,10909,0.02%,Procedure,SNOMED,572701000119102,Procedure
6212900,"","",IMG5097,US BREAST DIAGNOSTIC LEFT,10901,0.02%,"","","",""
1175888,"","",NUR3824,EXPECTED DISCHARGE COMMUNICATION,10901,0.02%,"","","",""
8649429,No matching concept,0,LAB2113,ZZZMICROARRAY ARRAY CGH (CYTOGENETICS) (YMG),10899,0.02%,Metadata,None,No matching concept,Undefined
9266538,No matching concept,0,EP95,CASE REQUEST EP (SRC),10880,0.02%,Metadata,None,No matching concept,Undefined
5924101,"","",IMG2266,XR KNEE 3 VIEWS,10873,0.02%,"","","",""
1303567,No matching concept,0,LAB5020,LEGIONELLA PNEUMOPHILA ANTIGEN  URINE,10865,0.02%,Metadata,None,No matching concept,Undefined
7516457,Rotavirus screening test,4191835,LAB443,ROTAVIRUS ANTIGEN  STOOL     (GH L),10863,0.02%,Procedure,SNOMED,395056003,Procedure
4942432,No matching concept,0,PFT158,THREE MINUTE STEP TEST (YNH ONLY),10853,0.02%,Metadata,None,No matching concept,Undefined
9292694,No matching concept,0,NUR1201,ZZZRETIRED ED MED DISPENSE,10846,0.02%,Metadata,None,No matching concept,Undefined
