procedure_id,concept_name,concept_id,order_code,order_description,frequency,percentage,domain_id,vocabulary_id,concept_code,concept_class_id
8269701,"Radiologic examination, complete acute abdomen series, including 2 or more views of the abdomen (eg, supine, erect, decubitus), and a single view chest",2211509,IMG2290,XR ABD  SUPINE AND UPRT (LM WH),2888,0.01%,Procedure,CPT4,74022,CPT4
8769072,"","",CSNB48,PPD READ ONLY,2887,0.01%,"","","",""
5262375,"","",LAB10426,MICROARRAY ARRAY CGH CHARGES (CYTOGENETICS) (YMG),2883,0.01%,"","","",""
6163381,"","",IMG4209,XR CERVICAL SPINE 6 OR MORE VIEWS(YH),2882,0.01%,"","","",""
3020877,"","",CON323,IP CONSULT TO HEART FAILURE NAVIGATOR NURSE,2878,0.01%,"","","",""
6275598,CT of internal auditory meatus with contrast,4325032,IMG1239,CT TEMPORAL BONES   INTERNAL AUDITORY CANALS W IV CONTRAST,2867,0.01%,Procedure,SNOMED,429857005,Procedure
2810923,No matching concept,0,LAB207,VDRL  CSF     (BH GH L LMW YH),2867,0.01%,Metadata,None,No matching concept,Undefined
1338088,No matching concept,0,IMG1268,MRA AND MRV BRAIN WO IV CONTRAST,2865,0.01%,Metadata,None,No matching concept,Undefined
5314217,No matching concept,0,LAB275,ANTIBODY TITER (BH GH LMW YH),2850,0.01%,Metadata,None,No matching concept,Undefined
7007506,"","",NUR566,NO HEAVY LIFTING,2849,0.01%,"","","",""
7610001,No matching concept,0,LAB3544,TISSUE CULTURE - FUNGAL     (YH),2849,0.01%,Metadata,None,No matching concept,Undefined
7462278,CT guided biopsy of left lung,37109471,IMG3533,CT GUIDED NEEDLE BIOPSY LUNG LEFT,2847,0.01%,Procedure,SNOMED,6481000087102,Procedure
1159273,"","",PRO206,CATHETER IV OR OTHER REMOVAL,2845,0.01%,"","","",""
8023835,No matching concept,0,LAB3802,WET PREP      (GH),2844,0.01%,Metadata,None,No matching concept,Undefined
1500493,"","",LAB1834,SURESWAB ADVANCED CANDIDA VAGINITIS (CV)  TMA (ORANGE TUBE)   (Q),2841,0.01%,"","","",""
4487676,"","",PRO256,BLADDER ULTRASOUND,2839,0.01%,"","","",""
8840899,No matching concept,0,NUR579,BB  RITUXIMAB INFUSION INSTRUCTIONS,2839,0.01%,Metadata,None,No matching concept,Undefined
1529554,No matching concept,0,IMG3226,NR C ARM FLUOROSCOPY UP TO 1 HOUR (BH),2835,0.01%,Metadata,None,No matching concept,Undefined
7576845,Enteroscopy,4123735,GI405,ENTEROSCOPY SMALL BOWEL (IMAGES),2832,0.01%,Procedure,SNOMED,235147008,Procedure
3986764,MRI of neck vessels,4084303,IMG3394,OSF MRA NECK,2829,0.01%,Procedure,SNOMED,241665001,Procedure
1145583,No matching concept,0,RT216,NEGATIVE INSPIRATORY FORCE (NON-VENTILATED PATIENT),2829,0.01%,Metadata,None,No matching concept,Undefined
4246898,No matching concept,0,IMG4034,MAMMO ADDITIONAL VIEWS TOMO RIGHT(GH LM WH),2827,0.01%,Metadata,None,No matching concept,Undefined
6955772,No matching concept,0,NUR1223,CONNECTICUT QUITLINE,2827,0.01%,Metadata,None,No matching concept,Undefined
3660781,No matching concept,0,LAB2882,DEEP WOUND CULTURE - FUNGAL     (YH),2827,0.01%,Metadata,None,No matching concept,Undefined
3987069,No matching concept,0,LAB7412,THINPREP PAP REFLEX HPV MRNA E6 E7     (Q),2822,0.01%,Metadata,None,No matching concept,Undefined
1047900,"Thyroid uptake, single or multiple quantitative measurement(s) (including stimulation, suppression, or discharge, when performed)",43527939,IMG344,NM THYROID UPTAKE AND SCAN MULTIPLE (BH GH LM WH),2817,0.01%,Procedure,CPT4,78012,CPT4
6236530,Assessment of adverse drug reactions,4288386,NUR557,MONITOR PATIENT FOR HYPERSENSITIVITY REACTIONS,2809,0.01%,Procedure,SNOMED,396079007,Procedure
2949908,No matching concept,0,RT42,NITRIC OXIDE (ADULT),2801,0.01%,Metadata,None,No matching concept,Undefined
7832653,No matching concept,0,RT130,NASAL CANNULA WITH BLENDER (NEWBORN),2800,0.01%,Metadata,None,No matching concept,Undefined
3227603,"","",IMG3366,OSF MRI TOTAL SPINE,2800,0.01%,"","","",""
4869858,"","",IMG15,XR ORBITS 4 + VW,2800,0.01%,"","","",""
7855994,Fetal biophysical profile,4070024,IMG3256,US MFM BIOPHYSICAL PROFILE TWINS (PERI ONLY)(GH YH BH NE LM),2795,0.01%,Procedure,SNOMED,21623001,Procedure
1642038,"","",IMG4272,MRI WHOLE BODY W AND OR WO IV CONTRAST (YH LM),2794,0.01%,"","","",""
6716751,Magnetic resonance arthrography of right hip,37109150,IMG1414,MRI ARTHROGRAM HIP RIGHT W CONTRAST(GH YH BH LM),2793,0.01%,Procedure,SNOMED,19831000087106,Procedure
5930768,Echocardiography,4230911,ECH103,ECHO 2D LTD W CFI IF IND IMAGE ENHANCEMENT AND OR 3D,2792,0.01%,Procedure,SNOMED,40701008,Procedure
1196368,"Doppler echocardiography, fetal, pulsed wave and/or continuous wave with spectral display; follow-up or repeat study",2211764,ECH105,FETAL ECHO FOLLOW UP W DOPPLER AND CFI,2786,0.01%,Procedure,CPT4,76828,CPT4
3591471,No matching concept,0,LAB7115,ZZZSURESWAB  BACTERIAL VAGINOSIS VAGINITIS     (Q),2783,0.01%,Metadata,None,No matching concept,Undefined
5324276,No matching concept,0,LAB3621,VDRL  CSF REFLEX TO TITER AND FTA-ABS     (YH),2781,0.01%,Metadata,None,No matching concept,Undefined
8481915,No matching concept,0,NUR579,KKK  PANITUMUMAB TREATMENT CONDITIONS,2780,0.01%,Metadata,None,No matching concept,Undefined
8351155,"","",REF60,AMB REFERRAL TO ORTHODONTICS,2779,0.0%,"","","",""
9864208,No matching concept,0,NUR579,AS  IFOSFAMIDE TREATMENT CONDITIONS,2767,0.0%,Metadata,None,No matching concept,Undefined
2505363,"","",LAB9585,ALZHEIMER DISEASE EVALUATION  SPINAL FLUID (BH GH LMW YH),2757,0.0%,"","","",""
7969296,Virtual CT colonoscopy,4303376,IMG1233,CT VIRTUAL COLONOSCOPY DIAGNOSTIC (BH YH),2750,0.0%,Procedure,SNOMED,418714002,Procedure
4355686,"","",DIET166,DIET BARIATRIC STEP 2,2749,0.0%,"","","",""
7789965,"","",NEU178,EEG (YM NEUROLOGY-FAIRFIELD ONLY),2744,0.0%,"","","",""
8190751,"Radiologic examination; acromioclavicular joints, bilateral, with or without weighted distraction",2211448,IMG87,XR ACROMIOCLAVICULAR JOINTS BILATERAL W WO WEIGHTS,2744,0.0%,Procedure,CPT4,73050,CPT4
7183451,"","",IMG3325,OSF CT THORACIC SPINE,2742,0.0%,"","","",""
7742466,No matching concept,0,LAB3135,HUMAN METAPNEUMOVIRUS PCR  NASOPHARYNX     (YH),2741,0.0%,Metadata,None,No matching concept,Undefined
4955381,No matching concept,0,IMM206,VACCINIA SMALLPOX MONKEYPOX  LIVE  PF,2733,0.0%,Metadata,None,No matching concept,Undefined
4818144,"","",115111,VERIFY TAKE-HOME MEDS,2733,0.0%,"","","",""
7311103,No matching concept,0,OPH139011,OPH INTRAVIT LET EYE AVASTIN,2726,0.0%,Metadata,None,No matching concept,Undefined
6492449,No matching concept,0,LAB8041,HLA-ABC TYPE (LOW RESOLUTION)     (BH GH LMW YH),2726,0.0%,Metadata,None,No matching concept,Undefined
7769961,"","",SUP1449,SPIROMETER INCENTIVE,2724,0.0%,"","","",""
2918667,No matching concept,0,OPH139018,OPH INTRAVIT RT EYE AVASTIN,2720,0.0%,Metadata,None,No matching concept,Undefined
6598860,"","",CON1,IP CONSULT TO COLORECTAL SURGERY,2718,0.0%,"","","",""
6663672,Transfusion of red blood cells,4022173,NUR1161,TRANSFUSE MT RBC,2718,0.0%,Procedure,SNOMED,116863004,Procedure
1600220,"","",IMG1389,MRI FEMUR RIGHT WO IV CONTRAST,2716,0.0%,"","","",""
7534704,"Computed tomographic angiography, head, with contrast material(s), including noncontrast images, if performed, and image postprocessing",2211339,IMG3335,OSF CTA NEURO NECK AND CIRCLE WILLIS,2714,0.0%,Procedure,CPT4,70496,CPT4
5602794,No matching concept,0,RT17,BEDSIDE SPIROMETRY,2712,0.0%,Metadata,None,No matching concept,Undefined
4652474,No matching concept,0,LAB3543,TISSUE CULTURE - ACID FAST     (YH),2711,0.0%,Metadata,None,No matching concept,Undefined
9093063,CT angiography of abdomen,3523707,IMG3341,OSF CTA ABDOMEN BODY,2711,0.0%,Procedure,SNOMED,182881000000108,Procedure
7595811,"","",IMG63,XR THORACIC SPINE AP LATERAL AND OBLIQUES(BH GH YH LM WH),2711,0.0%,"","","",""
2395109,No matching concept,0,IMG3357,OSF MRI BRAIN WO  MRA HEAD,2710,0.0%,Metadata,None,No matching concept,Undefined
6483370,No matching concept,0,RES1,RESTRAINTS VIOLENT OR SELF-DESTRUCTIVE ADOLESCENT (AGE 9 TO 17),2707,0.0%,Metadata,None,No matching concept,Undefined
2465208,No matching concept,0,LAB6934,PARVOVIRUS B19 PCR   (BH GH LMW YH),2705,0.0%,Metadata,None,No matching concept,Undefined
8287439,No matching concept,0,PHA2,AMINOGLYCOSIDE  PHARMACY TO DOSE,2703,0.0%,Metadata,None,No matching concept,Undefined
8820439,"","",REF53,AMB REFERRAL TO OCCUPATIONAL THERAPY,2699,0.0%,"","","",""
6789185,Occupational therapy assessment,4261887,OT2,OT EVALUATION,2698,0.0%,Procedure,SNOMED,410155007,Procedure
9072075,"","",REF42,AMB REFERRAL TO LACTATION,2694,0.0%,"","","",""
8252892,"","",NUR2273,PULMONARY ARTERY CATHETER MAINTENANCE,2691,0.0%,"","","",""
7724010,Change of gastrostomy tube,4266224,PRO143,FEEDING TUBE REPLACEMENT,2691,0.0%,Procedure,SNOMED,6125005,Procedure
3832854,"","",REF35,AMB REFERRAL TO HOME HOSPICE,2685,0.0%,"","","",""
7721793,"","",PRE7,CARDIAC STERNAL PRECAUTION,2684,0.0%,"","","",""
9752922,"","",REF167,AMB REFERRAL TO TRANSPLANT SURGERY,2683,0.0%,"","","",""
6514299,Transfusion of plasma,4028665,NUR1162,TRANSFUSE MT PLASMA,2678,0.0%,Procedure,SNOMED,13569004,Procedure
3997610,"","",IMG2328,US SOFT TISSUE MSK SHOULDER RIGHT,2678,0.0%,"","","",""
1707958,No matching concept,0,ADT99,ZZZRETIREDADMIT TO INPATIENT (YHC),2673,0.0%,Metadata,None,No matching concept,Undefined
7268272,"","",NUR953,INTIATE MASSIVE TRANSFUSION PROTOCOL,2672,0.0%,"","","",""
8682601,"","",REF08,AMBULATORY REFERRAL TO COLLABORATIVE CARE COCM (CONCERT HEALTH),2670,0.0%,"","","",""
4916120,No matching concept,0,IMG3176,CT RECONSTRUCTION ON INDEPENDENT WORKSTATION(GH YH BH YHC LM WH),2670,0.0%,Metadata,None,No matching concept,Undefined
5872922,"","",IMG38,XR CHEST PA LATERAL W BOTH OBLIQUE PROJECTIONS,2666,0.0%,"","","",""
2949326,Auscultation of the fetal heart,4075363,NUR453,ASSESS FETAL HEART TONES,2664,0.0%,Procedure,SNOMED,225158009,Procedure
3053195,"","",IMG1391,MRI TIBIA  FIBULA LEFT WO IV CONTRAST,2663,0.0%,"","","",""
1394793,MRI of right tibia and fibula,37118827,IMG1388,MRI TIBIA  FIBULA RIGHT WO IV CONTRAST,2658,0.0%,Procedure,SNOMED,6731000087106,Procedure
2719647,No matching concept,0,NUR2224,PUPIL ASSESSMENT,2651,0.0%,Metadata,None,No matching concept,Undefined
1599535,No matching concept,0,NUR2222,TRAIN OF FOUR ASSESSMENT,2646,0.0%,Metadata,None,No matching concept,Undefined
7219906,Optical coherence tomography of retina,45763633,OPH339,OCT  RETINA - OU - BOTH EYES,2643,0.0%,Procedure,SNOMED,700070005,Procedure
8234893,"","",NUR2237,TARGETED TEMPERATURE MANAGEMENT (TTM),2642,0.0%,"","","",""
8750713,"Radiologic examination, abdomen; 3 or more views",724988,IMG155,XR ABDOMEN AP OBLIQUE AND CONE (YH YHC LM WH),2642,0.0%,Procedure,CPT4,74021,CPT4
5110367,Assessment using visual analog pain scale,40492247,RT171,AVAPS BH,2641,0.0%,Procedure,SNOMED,445719003,Procedure
3031800,"","",IMG1306,XR ELBOW BILATERAL AP LATERAL AND OBLIQUES(GH BH YHC YH LM),2639,0.0%,"","","",""
8215726,No matching concept,0,NUR1857,HRU RESEARCH LAB  POST-DOSE,2637,0.0%,Metadata,None,No matching concept,Undefined
5647365,Biopsy of sentinel lymph node of breast,44808115,IMG2938,US GUIDED BREAST LYMPH NODE BIOPSY RIGHT,2632,0.0%,Procedure,SNOMED,847671000000109,Procedure
3586198,"","",NUR460,GROIN SITE ASSESSMENT,2630,0.0%,"","","",""
5784719,"","",IMG5107,MRI 3D RECONSTRUCTION FOR PROSTATE BIOPSY (YH),2629,0.0%,"","","",""
5693625,No matching concept,0,IMG3902,CT 2D RECONSTRUCTION BONE (YH BH),2627,0.0%,Metadata,None,No matching concept,Undefined
7734685,No matching concept,0,NUR1254,TRANSFUSE MT PLATELETS YH BH SR,2622,0.0%,Metadata,None,No matching concept,Undefined
1107490,"","",SUP1448,SPACER MDI,2616,0.0%,"","","",""
3157607,"","",IMG4354,MRV BRAIN WO IV CONTRAST (YH BH GH YHC LM),2616,0.0%,"","","",""
6688362,"","",LAB9015,NUSWAB PLUS (VG+)  VAGINITIS     (L),2612,0.0%,"","","",""
4698823,Electroencephalogram (EEG); including recording awake and drowsy,2314103,NEU15,EEG AWAKE AND DROWSY,2610,0.0%,Procedure,CPT4,95816,CPT4
9264450,Low dose computed tomography of thorax,37017298,IMG3633,CT ULTRA LOW DOSE KIDNEY STONES (ABD PEL WO IV CONTRAST)(LM),2609,0.0%,Procedure,SNOMED,713548006,Procedure
8727688,No matching concept,0,IMG3271,US MFM CVS GUIDANCE 1 PLACENTA AND 1ST TRI (PERI ONLY)(YH BH),2608,0.0%,Metadata,None,No matching concept,Undefined
5411529,No matching concept,0,IMG3761,US MFM GUIDED HYSTERO SONOGRAPHY (PERI ONLY)(YH BH LM),2607,0.0%,Metadata,None,No matching concept,Undefined
3694420,"","",LAB7477,THINPREP TIS PAP RFL HPV MRNA E6 E7  C. TRACHOMATIS N.GONORRHOEAE (Q),2601,0.0%,"","","",""
1577906,No matching concept,0,LAB246,AFB CULTURE  BLOOD,2596,0.0%,Metadata,None,No matching concept,Undefined
6867040,"","",CON58,IP CONSULT TO DENTIST,2593,0.0%,"","","",""
5137314,"","",NMC2984,NM MYOCARDIAL PERFUSION SPECT (STRESS AND REST) WITH DOBUTAMINE,2593,0.0%,"","","",""
8785096,"","",IMG317,MRI HIP LEFT W WO IV CONTRAST,2593,0.0%,"","","",""
3825230,No matching concept,0,LAB5784,CULTURE  HERPES SIMPLEX VIRUS W  TYPING     (Q),2590,0.0%,Metadata,None,No matching concept,Undefined
9840318,"","",LAB11288,SALMONELLA SHIGELLA CULT  CAMPY EIA AND SHIGA TOXIN W RFL E. COLI O157 CULT (Q),2588,0.0%,"","","",""
6105219,No matching concept,0,PRO604,AMB EXHALED CO LEVEL,2583,0.0%,Metadata,None,No matching concept,Undefined
2226935,"","",IMG1700,US SOFT TISSUE MSK FOOT LEFT,2579,0.0%,"","","",""
9557028,"","",LAB7708,THINPREP IMAGING PAP AND HPV MRNA E6 E7 RFL HPV 16 18 45 W CT NG (Q),2578,0.0%,"","","",""
3195872,Radionuclide imaging of whole body using iodine (131-I),35622380,IMG3779,NM I131 WHOLE BODY AND UPTAKE (GH YH),2574,0.0%,Procedure,SNOMED,763840007,Procedure
5869327,"","",IMG2374,CT MAXILLOFACIAL WO IV CONTRAST,2573,0.0%,"","","",""
8982157,No matching concept,0,NUR579,NNN  NO UA FOR BEVACIZUMAB,2573,0.0%,Metadata,None,No matching concept,Undefined
2693374,"","",NUR1018,ULTRASOUND MACHINE TO BEDSIDE,2572,0.0%,"","","",""
4479327,CT cystography,46272797,IMG2758,CT CYSTOGRAM(GH BH YH LM WH),2568,0.0%,Procedure,SNOMED,711227002,Procedure
6537336,"Magnetic resonance (eg, proton) imaging, temporomandibular joint(s)",2211318,IMG259,MRI TEMPOROMANDIBULAR JOINTS,2563,0.0%,Procedure,CPT4,70336,CPT4
4548160,Fetal echocardiography,4334808,IMG3914,US MFM NEW FETAL ECHO TWINS (PERI ONLY)(YH BH),2562,0.0%,Procedure,SNOMED,433235006,Procedure
7991411,"","",IMG1305,XR ELBOW BILATERAL AP AND LATERAL  (GH BH YH LM),2557,0.0%,"","","",""
8873604,"","",PFT165,POC FENO (NE ONLY),2554,0.0%,"","","",""
8193544,No matching concept,0,LAB8043,HLA-DR TYPE (LOW RESOLUTION)     (BH GH YH),2550,0.0%,Metadata,None,No matching concept,Undefined
5255456,"","",IMG4154,US MFM DOPPLER UMBILICAL ARTERY SINGLE (PERI ONLY)(BH YH LM),2545,0.0%,"","","",""
1297619,No matching concept,0,LAB6439,SHIGA TOXIN  EIA (GH L),2544,0.0%,Metadata,None,No matching concept,Undefined
8257766,Pressure controlled ventilation,4120570,RT183,PRESSURE CONTROL VENTILATION (PEDIATRIC),2539,0.0%,Procedure,SNOMED,286812008,Procedure
6500149,"","",NEU211,LMMG BOTOX INJ,2535,0.0%,"","","",""
6587592,Fluoroscopic arthrography with injection of hip joint,3527133,IMG2872,FL ARTHROGRAM INJECTION HIP RIGHT (YH BH GH LM),2530,0.0%,Procedure,SNOMED,317541000000107,Procedure
6577092,"","",NUR2250,ASSESS SKIN UNDER PADS,2528,0.0%,"","","",""
3061583,"","",LAB3851,CULTURE  SALMONELLA AND SHIGELLA     (Q),2526,0.0%,"","","",""
7822621,No matching concept,0,LAB495,RSV SCREEN  EIA     (BH),2526,0.0%,Metadata,None,No matching concept,Undefined
6502079,No matching concept,0,LAB202,HEMATOCRIT  BODY FLUID (BH GH LMW YH),2525,0.0%,Metadata,None,No matching concept,Undefined
6493316,Noninvasive ear or pulse oximetry for oxygen saturation; by continuous overnight monitoring (separate procedure),2314049,RT211,OVERNIGHT OXIMETRY X1,2524,0.0%,Procedure,CPT4,94762,CPT4
8020601,Bilateral mammography,4182722,IMG3834,MAMMO DIAGNOSTIC BILATERAL WO CAD (BH YH LM WH),2524,0.0%,Procedure,SNOMED,43204002,Procedure
6603997,"","",PRO853,CELLULAR AND OR TISSUE PRODUCTS,2522,0.0%,"","","",""
8472131,"","",IMG3473,US ABI AND DUPLEX LOWER EXTREMITY ARTERIES BILATERAL,2514,0.0%,"","","",""
4827685,"","",IMG1403,MRI TIBIA  FIBULA LEFT W WO IV CONTRAST,2507,0.0%,"","","",""
2941619,"","",CON86,IP CONSULT TO PEDIATRIC INFECTIOUS DISEASES,2506,0.0%,"","","",""
9141743,No matching concept,0,LAB4934,BK VIRUS BY PCR  QUANTITATIVE  URINE     (BH GH LMW YH),2505,0.0%,Metadata,None,No matching concept,Undefined
9090243,"","",IMM303,RSV  RECOMBINANT  PROTEIN SUBUNIT RSVPREF  ADJUVANT RECONSTITUTED  0.5 ML  PF (AREXVY),2501,0.0%,"","","",""
7667594,"","",IMG1701,US SOFT TISSUE MSK FOOT RIGHT,2496,0.0%,"","","",""
4665588,"","",CON308,IP CONSULT TO SPINE SURGERY,2494,0.0%,"","","",""
7650483,"","",MYC2103,ENROLL PATIENT IN HIP CARE COMPANION,2483,0.0%,"","","",""
5065021,No matching concept,0,NUR8077,BED COMPELLA BARIATRIC,2483,0.0%,Metadata,None,No matching concept,Undefined
4385037,No matching concept,0,IMM105,FLU VAC INTRADERMAL QUAD  18-64YRS PF,2481,0.0%,Metadata,None,No matching concept,Undefined
5336244,Doppler ultrasonography of vascular structure of fetal head,37396331,IMG4816,US HEAD NEONATAL WITH LTD DOPPLER,2476,0.0%,Procedure,SNOMED,716100006,Procedure
5999124,"","",IMG219,CT PELVIS W WO IV CONTRAST,2472,0.0%,"","","",""
7966127,"","",CON88,IP CONSULT TO PEDIATRIC NEUROLOGY,2469,0.0%,"","","",""
6157526,"","",IMG4522,OSF US CAROTID,2469,0.0%,"","","",""
4127333,No matching concept,0,LAB10003,WEST NILE VIRUS ANTIBODY IGG AND IGM  CSF (BH GH LMW YH),2469,0.0%,Metadata,None,No matching concept,Undefined
5466446,"","",IMG1392,MRI FEMUR LEFT WO IV CONTRAST,2465,0.0%,"","","",""
2542953,"","",IMG779,FL > 1 HOUR (YH BH GH LM WH),2464,0.0%,"","","",""
2745935,"","",IMG80,XR SCAPULA RIGHT,2461,0.0%,"","","",""
6528981,"","",IMG4399,PET CT BRAIN IMAGING WITH AMYLOID (YH LM),2460,0.0%,"","","",""
8973159,"","",PRO43,BRONCHOSCOPY,2460,0.0%,"","","",""
6207018,Ultrasonic guidance for thoracentesis,4148956,IMG3742,US GUIDED THORACENTESIS LEFT,2457,0.0%,Procedure,SNOMED,30726001,Procedure
9399817,"Magnetic resonance (eg, proton) imaging, pelvis; without contrast material(s)",2211426,IMG2700,MRI PELVIS BONE WO IV CONTRAST (BH YH GH YHC LM),2453,0.0%,Procedure,CPT4,72195,CPT4
8316782,"","",IMG4615,US SOFT TISSUE AXILLA BILAT (BH YH LM WH),2453,0.0%,"","","",""
7762166,"","",ADT61,ZZZRETIREDADMIT TO INPT PSYCH,2450,0.0%,"","","",""
7339945,"","",IMG4029,MRI BRAIN W 3D VOLUMETRIC ANALYSIS W WO IV CONTRAST (YH GH),2449,0.0%,"","","",""
4259941,"","",RT100,HOME OXYGEN ORDER,2447,0.0%,"","","",""
2840610,No matching concept,0,LAB2745,CATHETER TIP CULTURE (LAB ORDERABLE ONLY) (BH GH LMW YH),2446,0.0%,Metadata,None,No matching concept,Undefined
2454728,No matching concept,0,IMM96,MENINGOCOCCAL B  RECOMBINANT (TRUMENBA),2444,0.0%,Metadata,None,No matching concept,Undefined
8906527,"Magnetic resonance (eg, proton) imaging, brain (including brain stem); without contrast material, followed by contrast material(s) and further sequences",2211353,IMG274,MRI BRAIN W WO IV CONTRAST INTRAOP (YH),2440,0.0%,Procedure,CPT4,70553,CPT4
6360090,"","",LAB6285,SEMEN ANALYSIS  COMPLETE     (LMW Q),2434,0.0%,"","","",""
7818164,No matching concept,0,LAB740,OLIGOCLONAL BANDING     (L),2431,0.0%,Metadata,None,No matching concept,Undefined
6260736,"","",IMG79,XR SCAPULA LEFT,2430,0.0%,"","","",""
5564742,"","",IMG4277,US ABDOMEN COMPLETE W DOPPLER (BHOR GH LM WH),2428,0.0%,"","","",""
5830217,"","",IMG2327,US SOFT TISSUE MSK SHOULDER LEFT,2427,0.0%,"","","",""
6743540,"","",PFT49,PEDIATRIC CARDIOPULMONARY EXERCISE STUDY (CPET),2423,0.0%,"","","",""
1635545,"","",IMG2722,MRI TOTAL SPINE BONE W WO IV CONTRAST (YH GH BH YHC),2420,0.0%,"","","",""
6124357,No matching concept,0,NUR579,UC  CARFILZOMIB CARDIAC MONITORING,2415,0.0%,Metadata,None,No matching concept,Undefined
8641771,No matching concept,0,EP57,CASE REQUEST EP (GH),2415,0.0%,Metadata,None,No matching concept,Undefined
3731199,No matching concept,0,LAB8508,ZZZHUMAN METAPNEUMOVIRUS PCR     (BH YH),2409,0.0%,Metadata,None,No matching concept,Undefined
3878529,"","",NUR1184,APHERESIS INTERNAL ERYTHROCYTAPHERESIS 36512,2408,0.0%,"","","",""
6952891,No matching concept,0,LAB6436,LEGIONELLA ANTIGEN  URINE     (YH),2407,0.0%,Metadata,None,No matching concept,Undefined
2925550,No matching concept,0,LAB5645,GC AND CHLAMYDIA SDA  URINE     (BH),2406,0.0%,Metadata,None,No matching concept,Undefined
2540666,"","",IMG4920,US RENAL WITH CONTRAST (YH LM),2406,0.0%,"","","",""
1686594,"","",IMG2451,CT LOWER EXTREMITY RIGHT WO IV CONTRAST,2404,0.0%,"","","",""
2870656,Ultrasonography of soft tissue,4205771,IMG4243,ED SOFT TISSUE ULTRASOUND,2404,0.0%,Procedure,SNOMED,438527007,Procedure
8272349,No matching concept,0,DIET49,DIET PERITONEAL DIALYSIS,2402,0.0%,Metadata,None,No matching concept,Undefined
4386007,Electroencephalogram (EEG); including recording awake and asleep,2314104,NEU53,EEG AWAKE AND ASLEEP,2400,0.0%,Procedure,CPT4,95819,CPT4
2019521,"","",WOU2,ROUTINE OSTOMY MANAGEMENT,2396,0.0%,"","","",""
1049342,"","",LAB4735,SPECIMEN TO SURGICAL PATHOLOGY     (BH YH),2392,0.0%,"","","",""
2432114,"","",LAB10050,DUFFY ANTIGEN TYPING (BENIGN NEUTROPENIA) (BH GH LMW YH),2390,0.0%,"","","",""
5135303,"","",ADT184,ED TELEPSYCH,2384,0.0%,"","","",""
3091951,Single photon emission computed tomography of bone,4332799,IMG403,NM SPECT BONE,2380,0.0%,Procedure,SNOMED,432630004,Procedure
8722903,"","",HM10,HM FOBT FIT(OCCULT BLOOD INSURE) 1 YEAR,2379,0.0%,"","","",""
4252348,No matching concept,0,LAB4614,PUBLIC HEALTH SENDOUT *LAB ORDER ONLY*,2379,0.0%,Metadata,None,No matching concept,Undefined
2282344,"","",COD13,PARTIAL ACLS,2378,0.0%,"","","",""
8938566,"","",MYC2104,ENROLL PATIENT IN KNEE CARE COMPANION,2377,0.0%,"","","",""
9470460,"","",IMG1399,MRI TIBIA  FIBULA RIGHT W WO IV CONTRAST,2373,0.0%,"","","",""
3059721,"","",IMG1226,MRI ARTHROGRAM HIP LEFT W CONTRAST(GH YH BH LM),2373,0.0%,"","","",""
5328714,"","",LAB11394,ABL BLOOD GAS ARTERIAL (POC)(YH),2372,0.0%,"","","",""
5478982,"","",115013,IPILIMUMAB TREATMENT CONDITION,2351,0.0%,"","","",""
2228683,"","",IMG1417,MRI ANKLE LEFT W WO IV CONTRAST,2348,0.0%,"","","",""
6256275,"","",LAB4464,HPV GENOTYPE  16 18     (GH L),2348,0.0%,"","","",""
4670238,"","",LAB8045,RH TYPE     (BH GH Q YH),2343,0.0%,"","","",""
2365237,"","",IMG3737,MRI BRAIN FUNCTIONAL W MD (YH),2339,0.0%,"","","",""
4146147,No matching concept,0,RT27,BIPAP: PATIENT OWNED EQUIPMENT (ADULT),2337,0.0%,Metadata,None,No matching concept,Undefined
1958186,"","",CON26,IP CONSULT TO TRAUMA SURGERY,2336,0.0%,"","","",""
1456917,No matching concept,0,PRO118,VENIPUNC NEED PHYS SKILL DX OR RX,2335,0.0%,Metadata,None,No matching concept,Undefined
5545907,"","",IMG3478,US NON-OB PELVIS LIMITED WITH LIMITED DOPPLER (BH YH YHC LM),2331,0.0%,"","","",""
1240236,"","",IMG1449,XR BONE SURVEY COMPLETE (YH YHC LM WH),2330,0.0%,"","","",""
2284663,"","",115201,ENFORTUMAB VEDOTIN-EJFV,2328,0.0%,"","","",""
5545736,"","",NUR552,PATIENT MAY SELF STRAIGHT CATH.,2322,0.0%,"","","",""
4101500,"","",115901I,ALBUMIN-BOUND PACLITAXEL TREATMENT CONDITION,2316,0.0%,"","","",""
7704040,"","",SUP908,CRUTCH ADULT MED,2313,0.0%,"","","",""
7084854,No matching concept,0,CON291,IP CONSULT TO NEUROPSYCHOLOGY,2313,0.0%,Metadata,None,No matching concept,Undefined
1336670,"","",IMG3463,MRI FEMUR BILATERAL WO IV CONTRAST (BH YH YHC LM),2313,0.0%,"","","",""
2129882,"","",IMG5005,US OB TRANSVAGINAL OR TRANSABDOMINAL,2312,0.0%,"","","",""
2863319,"","",IMM305,RSV  BIVALENT  PROTEIN SUBUNIT RSVPREF  DILUENT RECONSTITUTED  0.5 ML  PF (ABRYSVO),2312,0.0%,"","","",""
8572602,No matching concept,0,LAB7800,ZZZFECAL LEUKOCYTES  EIA     (BH),2311,0.0%,Metadata,None,No matching concept,Undefined
5636932,No matching concept,0,RT194,SPONTANEOUS CPAP  VENTILATOR (PEDIATRIC),2311,0.0%,Metadata,None,No matching concept,Undefined
9830812,"","",REF81,AMB REFERRAL TO PEDIATRIC PSYCHOLOGY,2310,0.0%,"","","",""
5475424,Electroacoustic evaluation for hearing aid; binaural,2313758,AUD47,HEARING AID BINAURAL EVALUATION,2308,0.0%,Procedure,CPT4,92595,CPT4
8854442,No matching concept,0,IMG3765,US MFM REPEAT FETAL ECHOCARDIOGRAM (PERI ONLY)(YH BH),2307,0.0%,Metadata,None,No matching concept,Undefined
3194345,No matching concept,0,IMG3217,ED PROCEDURAL ULTRASOUND VENOUS ACCESS,2307,0.0%,Metadata,None,No matching concept,Undefined
8205852,"","",IMO8,INGESTION CHALLENGE TEST,2302,0.0%,"","","",""
7097905,"","",HM9,HM AAA SCREENING,2301,0.0%,"","","",""
5701756,"","",NUR1282,INTERNAL ORDERS:HPC(A) AUTOLOGOUS COLLECTION,2298,0.0%,"","","",""
6655602,"","",IMG1717,US SOFT TISSUE MSK HAND RIGHT,2296,0.0%,"","","",""
1145445,"","",IMG4138,URO US RENAL LIMITED,2292,0.0%,"","","",""
5481068,"","",NUR1352,PERFORM POCT CREATININE (YH),2287,0.0%,"","","",""
4271918,"","",LAB9433,ZZZTHINPREP PAP AND HPV DNA  C. TRACHOMATIS AND N. GONORRHOEAE (Q),2283,0.0%,"","","",""
5556082,"","",LAB3670,SURGICAL PROCEDURES     (YH),2281,0.0%,"","","",""
9562544,"","",IMG1415,MRI ANKLE RIGHT W WO IV CONTRAST,2279,0.0%,"","","",""
9056234,"","",IMG333,MRI VACUUM ASSISTED BREAST BIOPSY LEFT(BH GH YH LM),2276,0.0%,"","","",""
1521424,No matching concept,0,LAB199,ZZZSPECIFIC GRAVITY  BODY FLUID     (BH LMW),2272,0.0%,Metadata,None,No matching concept,Undefined
7167737,"","",CON295,IP CONSULT TO PROGRESSIVE CARE,2272,0.0%,"","","",""
7178835,No matching concept,0,LAB2881,DEEP WOUND CULTURE - ACID FAST     (YH),2272,0.0%,Metadata,None,No matching concept,Undefined
8541780,"","",LAB7585,ZZZPAP IG HPV-HR DNA DETECTION W RFL HPV GENOTYPE 16 18     (L),2262,0.0%,"","","",""
8134531,"","",PFT38,SPIROMETRY PRE POST BRONCHODILATOR,2261,0.0%,"","","",""
5888415,Intraoperative radiography of hip,4258550,IMG121,XR HIP INTRAOPERATIVE RIGHT(BH GH LM WH),2254,0.0%,Procedure,SNOMED,439514002,Procedure
2012525,"","",LAB7541,ZZZSURESWAB  CT NG  T. VAGINALIS     (Q),2252,0.0%,"","","",""
1007566,"","",NUR84,MUST BE UP FOR MEALS,2251,0.0%,"","","",""
