procedure_id,concept_name,concept_id,order_code,order_description,frequency,percentage,domain_id,vocabulary_id,concept_code,concept_class_id
7917837,"","",IMG2249,XR ELBOW 2 VIEWS,395,0.0%,"","","",""
1119115,"","",1151210890,Y NONELECTIVE CANCER TREATMENT REQUEST,395,0.0%,"","","",""
8932549,"","",IMG4259,NR FL GUIDED ASP INJECTION MAJOR JOINT LEFT(YH GH),394,0.0%,"","","",""
2189383,"","",NUR34,CHANGE TRACHEOSTOMY,394,0.0%,"","","",""
5615755,"","",OPH1008,VISANTE ANTERIOR SEGMENT QUAD  - OU - BOTH EYES,394,0.0%,"","","",""
8277198,"","",DIET103,DIET PANCREATITIS STEP THREE,394,0.0%,"","","",""
7047250,"","",IMG4669,XR ABDOMEN LATERAL INFANT OR CHILD (YH),394,0.0%,"","","",""
3715026,"","",IMG3785,NR FLUORO NO CHARGE(YH),394,0.0%,"","","",""
1863164,"","",NUR1158,TRANSFUSE EMERGENT PLASMA,394,0.0%,"","","",""
7610076,"","",OPH370,PROPHYLAXIS OF RETINAL DETACHMENT  LASER - OS - LEFT EYE,393,0.0%,"","","",""
2528650,"","",Y2072,YM DESTRUCTION OF BENIGH LESIONS LIMITED SIMPLE,392,0.0%,"","","",""
5947597,"","",IMG2877,FL ARTHROGRAM INJECTION WRIST LEFT (YH BH GH LM),392,0.0%,"","","",""
3048190,"","",REF190,AMBULATORY REFERRAL TO TO APHERESIS FOR IMMUNE EFFECTOR CELLS,392,0.0%,"","","",""
2512162,"","",CON260,IP CONSULT TO LAB MEDICINE,392,0.0%,"","","",""
3065094,"","",IMG4993,NM LU-177 PSMA PLUVICTO (YH),391,0.0%,"","","",""
7683500,"","",NEU181,CONTINUOUS EEG (GH ONLY),391,0.0%,"","","",""
7714182,"","",MYC2109,ENROLL PATIENT IN ANTERIOR CERVICAL SPINE CARE COMPANION,391,0.0%,"","","",""
5361663,"","",OPH135,AUTOFLUORESCENCE - OU - BOTH EYES,390,0.0%,"","","",""
9836625,"","",IMG1619,XR ANKLE LEFT AP (GH),390,0.0%,"","","",""
7588391,"","",LAB10291,ZZZCBC  BONE MARROW SMEAR AND STAIN (BH GH YH),389,0.0%,"","","",""
9318359,"","",IMG4330,OSF MRI BREAST CORE BIOPSY RIGHT,389,0.0%,"","","",""
6954075,"","",REF1841,AMB REF TRANSPLANT - REFERRAL TO EXTERNAL ORGANIZATION,389,0.0%,"","","",""
8624079,"","",LAB10989,CELL CULTURE ONLY (CYTOGENETICS) (YMG),388,0.0%,"","","",""
1281296,"","",CON219,IP CONSULT TO CARDIAC REHAB NURSE,388,0.0%,"","","",""
8555843,"","",IMM27,HEPATITIS B VACCINE ADOLESCENT 2 DOSE IM,388,0.0%,"","","",""
9261295,"","",IMG2854,CT STEREOTACTIC LOCALIZATION SINUS (YH),387,0.0%,"","","",""
3273273,"","",IMG1786,MRI SHOULDER RIGHT W IV CONTRAST(GH YH BH YHC WH),386,0.0%,"","","",""
1052543,"","",PRV2,LIMIT PHONE CALLS,386,0.0%,"","","",""
4396041,"","",IMG4590,US CALL BACK (LM),386,0.0%,"","","",""
6561942,"","",IMG4099,OSF NM RENAL,386,0.0%,"","","",""
9818070,"","",REF385,AMB REF TO YHC AMBULATORY PHARMACY SERVICES,386,0.0%,"","","",""
5549016,"","",NUR1054,TRANSFUSE FACTOR VIIA CONCENTRATE,386,0.0%,"","","",""
1998120,"","",115119A,CONCOMITANT IMMUNOSUPPRESSIVES,386,0.0%,"","","",""
4988499,"","",Y8055,YM NON-PSYCHOTHERAPY SVC  20 MINUTES,386,0.0%,"","","",""
7974500,"","",1152000005,HIC INFORMATION 5,385,0.0%,"","","",""
7470383,"","",IMG1319,CT SHOULDER LEFT W IV CONTRAST,385,0.0%,"","","",""
6840287,"","",SUP29,BULB SUCTION DRAIN,385,0.0%,"","","",""
3308354,"","",DIET154,DIET CHOICE,385,0.0%,"","","",""
5850938,"","",PR756,PROC BIOPSY OF SKIN LESION,384,0.0%,"","","",""
9809477,"","",1152000008,HIC INFORMATION 8,384,0.0%,"","","",""
5779114,"","",LABEX10102,ONCOTYPE DX PROSTATE (YH SCAN RESULTS ONLY),383,0.0%,"","","",""
2064129,"","",EDU168,PATIENT EDUCATION VIDEO: NUTRITION: SUGARY DRINKS AND ALCOHOL,383,0.0%,"","","",""
2363980,"","",IMG4533,IR IMAGING PROCEDURE PARK AVE BH,382,0.0%,"","","",""
5475764,"","",LAB109,PH  STOOL     (GH L Q YH),381,0.0%,"","","",""
7942330,"","",NEU162,SSEP- UPPER AND LOWER LIMB (YNH),381,0.0%,"","","",""
3737864,"","",IMG2952,US GUIDED BREAST BIOPSY RIGHT W CLIP,380,0.0%,"","","",""
1101682,"","",IMG4940,MRI ABDOMEN WITH 3D LIVER VOLUMES W WO IV CONTRAST (YH),379,0.0%,"","","",""
4334698,"","",LAB1042,LECITHIN-SPHINGOMYELIN RATIO (L S)     (YH),379,0.0%,"","","",""
3960952,"","",IMG2767,CT GUIDED ASPIRATION BONE,378,0.0%,"","","",""
8585005,"","",IMG2951,US GUIDED BREAST BIOPSY LEFT W CLIP,378,0.0%,"","","",""
4160169,"","",PRE9,A  SECURITY PRECAUTIONS,378,0.0%,"","","",""
1225190,"","",IMG4625,NR FL EPIDURAL STEROID INJECTIONS  CAUDAL  LUMBAR OR SACRAL,377,0.0%,"","","",""
8689513,"","",IMG4841,NM Y-90 MICROSPHERES POST TREATMENT SPECT-CT(YH LM),376,0.0%,"","","",""
3487777,"","",PFT52,BRONCHOSCOPY-WITH FLUOROSCOPY-NO ANESTHESIA (GH),376,0.0%,"","","",""
6156797,"","",IMG4014,MICU US FOCUSED BEDSIDE VASCULAR OR DVT ASSESSMENT,375,0.0%,"","","",""
5257701,"","",LAB4101,CRYPTO   CYCLO   ISOSPORA     (GH),375,0.0%,"","","",""
5301982,"","",IMG2832,CT LUMBAR SPINE BONE W IV CONTRAST (BHOR LM WH),375,0.0%,"","","",""
9536232,"","",RT38,NEBULIZER CONTINUOUS,374,0.0%,"","","",""
1376604,"","",RT221,CPT-CYSTIC FIBROSIS BRONCHIECTASIS PATIENTS ONLY,374,0.0%,"","","",""
5476379,"","",MYC2550,ENROLL PATIENT IN BARIATRIC POST-OPERATIVE CARE COMPANION,374,0.0%,"","","",""
3756696,"","",LAB6991,ARBOVIRUS ANTIBODY PANEL  IGG AND IGM  CSF     (YH),373,0.0%,"","","",""
8251919,"","",IMG4443,XR SPINE 1 VIEW,373,0.0%,"","","",""
8871570,"","",PHA43,EVALUATION FOR COVID-19 CONVALESCENT PLASMA (CCP) PHARMACY CONSULT,372,0.0%,"","","",""
6588377,"","",LAB8893,FLOW CYTOMETRTY - BRONCHIOALVEOLAR LAVAGE WITH CD4 CD8 RATIO     (YH),372,0.0%,"","","",""
6443018,"","",IMG3763,US MFM MULTIFETAL PREGNANCY REDUCTION (PERI ONLY)(YH),372,0.0%,"","","",""
4820500,"","",LABEX278,ANTIBODY SCREEN (ABSTRACTED),371,0.0%,"","","",""
3072241,"","",CON11,IP CONSULT TO ORAL SURGERY,371,0.0%,"","","",""
8605610,"","",IMG4969,MRA ABDOMEN PELVIS W AND WO CONTRAST,371,0.0%,"","","",""
2729810,"","",GI439,POUCHOSCOPY,371,0.0%,"","","",""
7421507,"","",PRO592,LUMBAR INTER-LAMINAR EPIDURAL STEROID INJ W IMG GDN,371,0.0%,"","","",""
9946547,"","",EQ36,COMMODE CHAIR,371,0.0%,"","","",""
1577021,"","",NMC435,PET SARCOID FDG SCAN,370,0.0%,"","","",""
4977623,"","",LAB3617,ZZZVARICELLA-ZOSTER VIRUS BY PCR  LESION     (YH),370,0.0%,"","","",""
1978959,"","",NUR2245,DISCHARGE DME,369,0.0%,"","","",""
6917219,"","",IMG4739,US DUPLEX UPP EXT ART VEIN POST CATH RIGHT (BH YH LM),369,0.0%,"","","",""
3131698,"","",LAB211,ZZZSYNOVIAL FLUID  CELL COUNT     (L),369,0.0%,"","","",""
4302398,"","",OPH2115,HVF 10-2 WHITE - OU - BOTH EYES,368,0.0%,"","","",""
7765954,"","",CON280,IP CONSULT TO NEOB,368,0.0%,"","","",""
6215145,"","",NUR1283,DONOR LYMPHOCYTE INTERNAL ORDERS,368,0.0%,"","","",""
2904517,"","",IMG3024,IR ENDOVASCULAR REPAIR,367,0.0%,"","","",""
7694706,"","",NUR412,PIN CARE,367,0.0%,"","","",""
5860020,"","",DIET100,DIET HIGH CALORIE HIGH PROTEIN,367,0.0%,"","","",""
1718243,"","",SUP145,WRIST SPLINT,367,0.0%,"","","",""
5031351,"","",IMG615,MAMMO STEREOTACTIC NEEDLE LOCALIZATION RIGHT (GH LM),366,0.0%,"","","",""
2521489,No matching concept,0,NUR807,BED EXCEL CARE BARIATRIC,366,0.0%,Metadata,None,No matching concept,Undefined
9589377,"","",NUR579,BM  RESEARCH STUDY COMMUNICATION,366,0.0%,"","","",""
9135100,"","",IMG3467,MRI SHOULDER BILATERAL WO IV CONTRAST (BH YH YHC LM WH),366,0.0%,"","","",""
7031336,"","",IMG119,FL ARTHROGRAM HIP RIGHT(GH BH YH LM),366,0.0%,"","","",""
9306084,"","",LAB2221,ZZZT CELL GENE REARRANGEMENT - BONE MARROW     (YH),366,0.0%,"","","",""
4866906,"","",WOU34,WOUND VAC MONITORING (PREVENA),365,0.0%,"","","",""
2476312,"","",1150000030D,HIC PSO2 RESTING,365,0.0%,"","","",""
7732350,"","",LAB3005,GENITAL CULTURE - FUNGAL     (YH),365,0.0%,"","","",""
4868392,"","",DIET33,DIET KOSHER,365,0.0%,"","","",""
1609601,"","",IMG1715,US SOFT TISSUE MSK WRIST BILATERAL(BH GH YH LM),365,0.0%,"","","",""
5473602,"","",LAB6674,NMDA RECEPTOR AB  IGG CSF W REFLEX TO TITER     (YH),364,0.0%,"","","",""
3001147,"","",IMG4897,CT ED CHEST ABDOMEN W IV CONTRAST,364,0.0%,"","","",""
6937165,"","",IMG1104,US GUIDED RENAL BIOPSY,364,0.0%,"","","",""
7921780,"","",LAB3081,HERPES SIMPLEX VIRUS CULTURE  LABIA     (YH),363,0.0%,"","","",""
9826315,"","",DIET101,DIET PANCREATITIS STEP ONE,363,0.0%,"","","",""
3060155,"","",NUR564,NO BLOOD OR BLOOD PRODUCTS,363,0.0%,"","","",""
7450936,"","",IMG3486,CT ARTHROCENTESIS ASPIR OR INJECT INTERMED JOINT LT (BH YH),362,0.0%,"","","",""
1168156,"","",LAB5939,URIC ACID  SYNOVIAL FLUID     (BH Q YH),362,0.0%,"","","",""
8896335,"","",IMG508,US GUIDED ABSCESS DRAINAGE,361,0.0%,"","","",""
5151302,"","",SUP6595,ZOLL LIFE VEST,359,0.0%,"","","",""
5372002,"","",NEU200,RAPID RESPONSE EEG (LMH ONLY),359,0.0%,"","","",""
4116793,"","",LAB2384,ADENOSINE DEAMINASE  PERITONEAL FLUID     (BH GH LMW YH),358,0.0%,"","","",""
3499060,"","",IMG2366,XR CHEST PA AND LATERAL W 1 OBLIQUES (BH YH),358,0.0%,"","","",""
9026330,"","",IMG5022,US (GENUS) SOFT TISSUE AXILLA LT,358,0.0%,"","","",""
2989651,"","",LAB5737,TYPE AND SCREEN     (BH),358,0.0%,"","","",""
6479752,"","",NUR7575,AIR MATTRESS TO BED,357,0.0%,"","","",""
6254719,"","",IMG3385,OSF MRI NON JOINT UPPER EXTREMITY RIGHT,357,0.0%,"","","",""
3773442,"","",IMG3672,XR KNEE LEFT AXIAL (YH GH YHC),357,0.0%,"","","",""
6077311,"","",IMG2498,MRI LOWER EXTREMITY ANY JOINT,356,0.0%,"","","",""
1151886,"","",LAB4620,TOXOPLASMA GONDII BY PCR  CSF     (YH),354,0.0%,"","","",""
7934004,"","",IMG3671,XR KNEE RIGHT AXIAL (YH GH YHC),354,0.0%,"","","",""
4667642,"","",IMG3485,CT ARTHROCENTESIS ASPIR OR INJECT INTERMED JOINT RT  (BH YH),354,0.0%,"","","",""
3952291,"","",LAB198,SODIUM  STOOL     (BH LMW Q YH),353,0.0%,"","","",""
5411681,"","",PFT3,BRONCHIAL CHALLENGE WITH METHACHOLINE,353,0.0%,"","","",""
2054955,"","",IMG477,NM I131 TUMOR SURVEILLANCE SPECT (LM),353,0.0%,"","","",""
1669830,"","",LAB9787,ZZZISOLATE REFERRAL TO LMH (LAB USE ONLY),353,0.0%,"","","",""
8581512,"","",1150001002,BEAM OP IP AUTO TREATMENT CONDITION,352,0.0%,"","","",""
8652442,"","",NUR1865,CSRU RESEARCH NURSING COMMUNICATION,352,0.0%,"","","",""
4503494,"","",NUR1055,TRANSFUSE FACTOR VIII CONCENTRATE,352,0.0%,"","","",""
4743113,"","",NMC4383,NM CARDIAC BLOOD VOLUME (DAXOR) STUDY,351,0.0%,"","","",""
4886615,"","",NUR919,ENT TRAY TO BEDSIDE,351,0.0%,"","","",""
1065897,"","",PFT168,EXERCISE OXIMETRY (WH ONLY),350,0.0%,"","","",""
6686334,"","",OPH1018,CIRRUS OCT MACULA CUBE  - OD,350,0.0%,"","","",""
5822590,"","",GI30,LIVER ELASTOGRAPHY W IMAG W I&R,349,0.0%,"","","",""
8074139,"","",IMG3855,PET CT BRAIN METABOLIC FOR SEIZURE DISORDERS(YH),349,0.0%,"","","",""
1481410,"","",PRE10,SKIN CARE PRECAUTIONS,349,0.0%,"","","",""
3761952,"","",DER1,DERM BIOPSY,349,0.0%,"","","",""
1043040,"","",EDU197,PATIENT EDUCATION VIDEO: PREDIABETES,348,0.0%,"","","",""
3594189,"","",LAB10646,ZZZSURESWAB(R) TRICHOMONAS VAGINALIS RNA  QL  TMA (Q),348,0.0%,"","","",""
1760761,"","",LAB8517,ZZZVIRAL CULTURE  NON-RESPIRATORY W CMV (BH LMW YH),347,0.0%,"","","",""
5685912,"","",IMG409,NM VASCULAR FLOW (YH BH),347,0.0%,"","","",""
5979376,"","",EDU493,PATIENT EDUCATION VIDEO: PREDIABETES AND YOUR BODY: OVERVIEW,347,0.0%,"","","",""
2103532,"","",IMG4436,US OB >14 WEEKS SINGLE OR FIRST GESTATION W TRANSVAGINAL(LM WH),346,0.0%,"","","",""
6846033,"","",IMG4836,MRI CARDIAC FUNCTION WO IV CONTRAST(YH GH),346,0.0%,"","","",""
6471354,"","",ADT145,PSYCH OBS STATUS CHANGE TO PSYCH INPT,346,0.0%,"","","",""
9219485,"","",IMG1401,MRI FOOT LEFT W IV CONTRAST(GH YH BH YHC WH),345,0.0%,"","","",""
7111625,"","",NUR1296,FLAT FOOT TOUCH DOWN WEIGHT BEARING,345,0.0%,"","","",""
9772745,"","",PRO137,US  RETROPERITNL ABD   LTD,344,0.0%,"","","",""
9771584,"","",NUR958,MINI-MENTAL STATE EXAM,344,0.0%,"","","",""
2533744,"","",OPH21057,FLUORESCEIN ANGIOGRAPHY AND ICG ANGIOGRAPHY OU,344,0.0%,"","","",""
9122349,"","",D2751,L  FH LAB D2751L,344,0.0%,"","","",""
6676760,"","",LAB3506,STREP B GENITAL CULTURE     (BH),343,0.0%,"","","",""
3281676,"","","","",343,0.0%,"","","",""
3518923,"","",IMG3551,CTA CHEST (PE) ABDOMEN PELVIS W IV CONTRAST,343,0.0%,"","","",""
1563608,"","",115053,SIPULEUCEL TREATMENT CONDITION,342,0.0%,"","","",""
7614810,"","",EDU53,PATIENT EDUCATION VIDEO: CLOSED BULB DRAINS (JP AND BLAKE),342,0.0%,"","","",""
2911102,"","",115090,METHOTREXATE TREATMENT CONDITION II,342,0.0%,"","","",""
1713480,"","",NMC2994,NM MYOCARDIAL PERF PLANAR (STRESS REST) WITH REGADENOSON (YH),341,0.0%,"","","",""
3318238,"","",NUR823,APPLY EYE SHIELD,341,0.0%,"","","",""
5086115,"","",IMG4954,XR PELVIS LOW DOSE 1 OR 2 VIEWS (YH),341,0.0%,"","","",""
4465671,"","",IMG3601,MAMMO STEREOTACTIC NEEDLE LOCALIZATION LEFT (GH LM),341,0.0%,"","","",""
9618731,"","",REF157,AMB REFERRAL TO PEDIATRIC TRANSPLANT HEPATOLOGY,340,0.0%,"","","",""
1728333,"","",IMG3518,NM KIDNEY W FLOW AND FUNCTION W DIURETIC MAG3 (GH),340,0.0%,"","","",""
9123922,"","",IMM310,COVID-19  PFIZER  5-11YR  10 MCG 0.3 ML,340,0.0%,"","","",""
2939293,"","",SUP38,CERVICAL COLLAR HARD,340,0.0%,"","","",""
3231843,"","",NUR579,BD  OKAY TO TREAT,340,0.0%,"","","",""
1871089,"","",OPH34,GOLDMANN PERIMETRY - OU - BOTH EYES,340,0.0%,"","","",""
5726602,"","",IMG2699,MRI LUMBAR PLEXUS BILATERAL W WO IV CONTRAST(BH YH GH YHC),340,0.0%,"","","",""
7719828,"","",LAB10947,MITOCHONDRIAL GENOME ANALYSIS (DNA LAB) (YMG),340,0.0%,"","","",""
2849637,"","",LAB233,ANAEROBIC CULTURE     (L),338,0.0%,"","","",""
1452740,"","",LAB7238,VIRAL RESPIRATORY  RAPID CULTURE W REFLEX (GH Q),338,0.0%,"","","",""
1569570,"","",IMG4843,NM Y-90 MICROSPHERES MAA MAPPING SPECT-CT(YH LM),338,0.0%,"","","",""
9710364,"","",IMG4649,MRI BRACH PLEX RIGHT THORACIC OUTLET W WO IV CONTRAST (Y L W G),337,0.0%,"","","",""
5106954,"","",IMG450,PET CT BRAIN PERFUSION EVALUATION(GH BH),337,0.0%,"","","",""
3638654,"","",IMG1788,MRI SHOULDER LEFT W IV CONTRAST(GH YH BH YHC WH)),336,0.0%,"","","",""
6121107,"","",REF159,AMB REFERRAL TO SPORTS MEDICINE,336,0.0%,"","","",""
2284420,"","",OPH38,HEIDELBERG RETINA TOMOGRAPHY (HRT) - OU - BOTH EYES,336,0.0%,"","","",""
2160049,"","",IMG2689,US SOFT MUSC EXTREM BILATERAL (BH YH YHC),336,0.0%,"","","",""
5459990,"","",IMG1421,MRA LOWER EXTREMITY BILAT W AND WO IV CONTRAST(GH YH BH LM),336,0.0%,"","","",""
9524786,"","",IMG1397,MRI FOOT RIGHT W IV CONTRAST(GH YH BH YHC WH),335,0.0%,"","","",""
9774762,"","",CON297,IP CONSULT TO PAIN MANAGEMENT (LMW),334,0.0%,"","","",""
1572848,"","",MYC4,MYCHART WEIGHT FLOWSHEET,334,0.0%,"","","",""
9714321,"","",IMG2308,XR LOWER LEG,334,0.0%,"","","",""
6181380,"","",COR45,MEDICAL REASON FOR NOT EXCLUSIVELY BREASTFEEDING,334,0.0%,"","","",""
1828829,"","",NUR579,FI  PALBOCICLIB TREATMENT CONDITIONS,333,0.0%,"","","",""
1192127,"","","","",333,0.0%,"","","",""
2240426,"","",LAB6191,PATHOLOGY GROSS EXAM ONLY,333,0.0%,"","","",""
8949267,"","",IMG578,MAMMO CAD SCREENING,332,0.0%,"","","",""
7664341,"","",LAB4376,PAP LB  HPV RFX HPV 16 18     (L),332,0.0%,"","","",""
2457164,"","",GI26,LIVER BIOPSY (IMAGES),332,0.0%,"","","",""
4018960,"","",EDU114,PATIENT EDUCATION VIDEO: HEART FAILURE : FULL PROGRAM,331,0.0%,"","","",""
1814061,"","",IMG3758,US MFM GENETIC PREG >14 WKS DETAIL TWINS (PERI ONLY)(YH LM),331,0.0%,"","","",""
3736925,"","",OPH1019,CIRRUS OCT MACULA CUBE - OS,331,0.0%,"","","",""
7263416,"","",IMG5023,US (GENUS) SOFT TISSUE AXILLA RT,331,0.0%,"","","",""
3517497,"","",NUR3250,INITIATE PRE-OP NURSING STANDING ORDERS PEDIATRICS,330,0.0%,"","","",""
9465155,"","",IMG4302,US MFM BIOPHYSICAL PROF W UMBILICAL MCA DOPPLER SINGLE(BH LM YH),330,0.0%,"","","",""
1485511,"","",NUR2235,NEONATAL ABSTINENCE SYNDROME PANEL,330,0.0%,"","","",""
3088785,"","",REF222,AMB REFERRAL TO WIC,330,0.0%,"","","",""
4404091,"","",IMG2463,MRI LOWER EXTREM NON JOINT BIL WO IV CONTRAST (YH),329,0.0%,"","","",""
1985283,"","",AUD41,ELECTRONYSTAGMOGRAPHY,329,0.0%,"","","",""
9716499,"","",LAB4001,CULTURE  VIRAL  BODY FLUIDS  TISSUES     (Q),329,0.0%,"","","",""
3047338,"","",LAB7062,IMMUNOGLOBULIN G  CSF     (LMW YH),328,0.0%,"","","",""
7439805,"","",IMG3329,OSF CTA ABDOMEN VASCULAR,328,0.0%,"","","",""
8626703,"","",IMG4526,OSF NM MYOCARDIAL,327,0.0%,"","","",""
1047917,"","",99499,NONBILLABLE WITH RVUS,327,0.0%,"","","",""
7457104,"","",ECH204,TRANSESOPHAGEAL ECHOCARDIOGRAM (TEE) OR INTERVENTIONAL,327,0.0%,"","","",""
1770433,"","",NUR1257,TRANSFUSE EMERGENT PLATELETS YH BH SR,326,0.0%,"","","",""
8656754,"","",IMG759,FL BARIUM ENEMA INTUSSUSCEPTION REDUCTION(GH YH BH),326,0.0%,"","","",""
2379069,"","",IMG374,NM SIR SPHERES LIVER (BH YH LM),326,0.0%,"","","",""
7774749,"","",IMG3784,NR FL FACET INJECTION OR(YH),325,0.0%,"","","",""
2707089,"","",IMG2326,US EXTREMITY NON VASCULAR RIGHT,325,0.0%,"","","",""
8130356,"","",NMC08,CARDIOPULM STRESS W MYOCARDIAL PERF SPECT (STRESS REST)W EXER(Y),324,0.0%,"","","",""
8142170,"","",IMG4235,MAMMO GUIDED CLIP PLACEMENT WITHOUT BIOPSY LEFT (YH LM GH),324,0.0%,"","","",""
2997747,"","",LAB4119,MDR-GRAM NEGATIVE ROD SCREEN  (BH GH LMW YH),324,0.0%,"","","",""
7417850,"","",IMG4718,NR MAMMO BREAST SPECIMEN IN OR (YH),324,0.0%,"","","",""
2215466,"","",NUR579,BBBB  DARBEPOETIN TREATMENT CONDITION,323,0.0%,"","","",""
5575507,"","",CON80,IP CONSULT TO PEDIATRIC DERMATOLOGY,323,0.0%,"","","",""
7274662,"","",PRO6,BIOPSY BONE MARROW,322,0.0%,"","","",""
5707152,"","",LAB3077,ZZZHERPES SIMPLEX VIRUS BY PCR  OCULAR FLD     (YH),322,0.0%,"","","",""
8021015,"","",ISO7,BURN PRECAUTIONS (BH ONLY),322,0.0%,"","","",""
9334489,"","",SHX456,SPIROMETRY,322,0.0%,"","","",""
2666388,"","",NEU197,RAPID RESPONSE EEG (YNH ONLY),322,0.0%,"","","",""
5088773,"","",IMG2662,FL FACET JOINT INJ DIAG OR THERA L1 TO S5 1ST LVL LT NR(BH YH),322,0.0%,"","","",""
2538161,"","",IMG1702,US SOFT TISSUE MSK FOOT BILATERAL(BH YH GH YHC LM),321,0.0%,"","","",""
2443467,"","",CON278,INPATIENT CONSULT TO HEPATOLOGY,321,0.0%,"","","",""
7466934,"","",IMG222,CT HUMERUS LEFT W IV CONTRAST,321,0.0%,"","","",""
7042570,"","",RT41,RESPIRATORY CARE EVALUATION ONLY,320,0.0%,"","","",""
8404390,"","",NMC428,PET CT MYOCARDIAL PERFUSION (AT REST) (YH),320,0.0%,"","","",""
7615227,"","",LAB2206,PML-RARA T(15 17) QUANTITATIVE  BONE MARROW     (YH),320,0.0%,"","","",""
3834606,"","",RT80,NITRIC OXIDE (PEDI),320,0.0%,"","","",""
1242946,"","",115001,LUTATHERA (LUTETIUM LU177 DOTATATE) TREATMENT CONDITION,319,0.0%,"","","",""
2159966,"","",LAB11882,MULTIPLE SCLEROSIS (MS) PROFILE  CSF (BH GH LMW YH),318,0.0%,"","","",""
3896985,"","",IMG3452,US INJECTION SINGLE TENDON LIGAMENT LEFT,318,0.0%,"","","",""
1785174,"","",LAB3595,UPPER RESPIRATORY TRACT CULTURE - FUNGAL     (YH),318,0.0%,"","","",""
1704249,"","",PRO854,EXTERNAL CEPHALIC VERSION (ECV),317,0.0%,"","","",""
6710509,"","",IMG2810,CT GUIDED NEEDLE BIOPSY BONE LOWER EXTREMITY OR SPINE RT(BH YH),317,0.0%,"","","",""
1104880,"","",IMG4195,US SOFT TISSUE MSK HIPS BILATERAL(YH LM),316,0.0%,"","","",""
5059268,"","",LAB11808,POST TRXN PHASE 1 (BH GH LMW YH),315,0.0%,"","","",""
9478037,"","",LAB3796,FUNGAL CULTURE  OTHER      (GH),315,0.0%,"","","",""
3376031,"","",1152000004,HIC INFORMATION 4,315,0.0%,"","","",""
6206173,"","",NUR1043,ORTHO EQUIP ELBOW ARM,315,0.0%,"","","",""
1599350,"","",IMG389,NM H PYLORI (GH YH),315,0.0%,"","","",""
9655821,"","",LAB7545,ZZZTHINPREP PAP REFLEX HPV DNA     (Q),315,0.0%,"","","",""
4227716,"","",IMG2839,CT GUIDED FNA LUNG RIGHT,315,0.0%,"","","",""
1774536,"","",NEU212,NEWBORN HEARING SCREEN (LMH ONLY),314,0.0%,"","","",""
2840043,"","",LAB8004,ANTIGEN TYPING     (BH GH LMW),314,0.0%,"","","",""
6511743,"","",SUP39,CERVICAL COLLAR SOFT,313,0.0%,"","","",""
6286965,"","",DNS8,MH SNACKS,313,0.0%,"","","",""
7687843,"","",LAB3087,HERPES SIMPLEX VIRUS CULTURE  VULVA     (YH),313,0.0%,"","","",""
9746541,"","",PR505,PROC CHEM CAUTERIZATION TISSUE GRANULATION,313,0.0%,"","","",""
6833717,"","",REF288,AMB REF TO AMBULATORY OFFICE INFUSION,313,0.0%,"","","",""
3479192,"","",PRO144,GASTRIC LAVAGE,312,0.0%,"","","",""
5817547,"","",IMG118,FL ARTHROGRAM HIP LEFT(GH BH YH LM),312,0.0%,"","","",""
4258671,"","",REF3,AMB REFERRAL TO ADOLESCENT MEDICINE,312,0.0%,"","","",""
1776928,"","",SUP1974,COMPRESSION STOCKINGS,312,0.0%,"","","",""
8574926,"","",IMG378,NM LIVER SPLEEN PLANAR,311,0.0%,"","","",""
9357537,"","",IMG4339,OSF NM HIDA SCAN,311,0.0%,"","","",""
4042049,"","",IMG1167,NM INFLAMMATORY WBC LTD W INDIUM 111 (YH BH GH LM),310,0.0%,"","","",""
2017546,"","",IMG5017,POC US CHEST,310,0.0%,"","","",""
7236643,"","",OPH902,ULTRASOUND BIOMICROSCOPY  OS - LEFT EYE,310,0.0%,"","","",""
9069195,"","",ECH03,FETAL ECHO 2D,310,0.0%,"","","",""
1165639,"","",NUR971,NO INJECTIONS ON OPERATIVE SIDE,310,0.0%,"","","",""
4256716,"","",IMG780,FL FISTULOGRAM ABSCESS SINUS TRACT  (YH BH GH LM WH),309,0.0%,"","","",""
5822523,"","",85511,CAPPING TRIAL,309,0.0%,"","","",""
6190990,"","",IMG4174,US MFM PREG >14 WKS LEVEL 1 WITH TRANSVAGINAL TWINS (GH BH YH LM),309,0.0%,"","","",""
4102724,"","",NUR911,MOBILITY RESTRICTION,309,0.0%,"","","",""
3901360,"","",IMG3453,US INJECTION SINGLE TENDON LIGAMENT RIGHT,308,0.0%,"","","",""
8207757,"","",115000102,ISATUXIMAB TREATMENT CONDITIONS,308,0.0%,"","","",""
3557586,"","",NMC414,PET CT MYOCARDIAL VIAB EVAL (STRESS REST) W REGADENOSON (YH),308,0.0%,"","","",""
5420330,"","",RT230,NASAL CANNULA- TITRATION WITH BLENDER (PEDIATRIC),307,0.0%,"","","",""
5179469,"","",IMG2844,CT PELVIS BONE W WO IV CONTRAST (YH YHC BHOR WH),306,0.0%,"","","",""
1453349,"","",LAB11815,AMBRY BRCAPLUS (BH GH LMW YH),305,0.0%,"","","",""
2322915,"","",IMG261,MRI NECK SOFT TISSUE W IV CONTRAST(BH YH GH YHC WH),305,0.0%,"","","",""
1624470,"","",IMG396,NM MECKELS DIVERTICULUM,304,0.0%,"","","",""
8277738,"","",LAB3507,STREP GROUP B BY PCR     (Q),304,0.0%,"","","",""
4887606,"","",LAB4380,PAP IG  RFX HPV-HR ASCU     (L),304,0.0%,"","","",""
8655388,"","",LAB3375,POTASSIUM  STOOL  RANDOM     (BH),303,0.0%,"","","",""
4325845,"","",LAB2854,CRYSTAL EXAM  BODY FLUID     (BH),303,0.0%,"","","",""
9692120,"","",IMG2737,CT CERVICAL SPINE BONE W IV CONTRAST(BH YH),303,0.0%,"","","",""
1066396,"","",Y8636,YM PLASTIC RESIDENTS NO CHARGE,303,0.0%,"","","",""
5921372,"","",IMG3462,MRI ANKLE BILATERAL WO IV CONTRAST (BH YH LM WH),302,0.0%,"","","",""
8947277,"","",IMG2769,CT GUIDED ASPIRATION ABDOMEN,302,0.0%,"","","",""
1579977,"","",IMG2321,US ORGAN TRANS 2D ONLY (GH YH LM WH),302,0.0%,"","","",""
2655665,"","",IMG3544,CT GUIDED SACROILIAC JOINT INJECTION RIGHT(GH BH YH LM),302,0.0%,"","","",""
8756938,"","",Y3402,YM POPH ECONSULT 0-4 MINUTES,301,0.0%,"","","",""
9904415,"","",LAB3559,TOXOPLASMA GONDII ANTIBODY  IGG  CSF     (YH),301,0.0%,"","","",""
6077424,"","",IMG771,FL LOOPOGRAM  (YH BH GH LM WH),301,0.0%,"","","",""
6793298,"","",IMG4160,US MFM DOPPLER UMBILICAL ARTERY TWINS (PERI ONLY)(BH YH LM),300,0.0%,"","","",""
7393529,"","",OPH123,YAG IRIDOTOMY - OS - LEFT EYE,300,0.0%,"","","",""
9959728,"","",LAB10201,ANAEROBE E-TEST PROFILE (YH),300,0.0%,"","","",""
3950258,"","",IMG2433,MRI SHOULDER WO IV CONTRAST,300,0.0%,"","","",""
6766944,"","",IMG1431,MRI ABDOMEN W IV CONTRAST MRCP,300,0.0%,"","","",""
9406730,"","",NMC4389,NM CARDIAC AMYLOID NUCLEAR PLANAR (BH YH),300,0.0%,"","","",""
7348804,"","",REF135,AMB REFERRAL TO CHILD ABUSE PEDIATRICS,299,0.0%,"","","",""
9812823,"","",IMG545,US MFM DOPPLER CARDIAC,299,0.0%,"","","",""
5696425,"","",IMG4332,OSF US BREAST BIOPSY BILATERAL,299,0.0%,"","","",""
5963240,"","",IMG3373,OSF MRI NON JOINT LOWER EXTREMITY BILATERAL,298,0.0%,"","","",""
4105854,"","",IMG5032,ED PEDI PROCEDURAL ULTRASOUND ORTHO,298,0.0%,"","","",""
3365072,"","",OPH86,YAG IRIDOTOMY - OD - RIGHT EYE,298,0.0%,"","","",""
4067877,"","",PFT156,OXIMETRY REST & EXERTION- NO TITRATION (LMH WH ONLY),296,0.0%,"","","",""
6851359,"","",IMG3384,OSF MRI NON JOINT UPPER EXTREMITY LEFT,296,0.0%,"","","",""
7180811,"","",IMG4240,ED DVT ULTRASOUND,296,0.0%,"","","",""
2360688,"","",CON299,INPATIENT DIABETES MANAGEMENT CONSULTATION,295,0.0%,"","","",""
7688887,"","",PT18,PT IONTOPHORESIS,295,0.0%,"","","",""
3415076,"","",LAB5188,CHLAMYDIA DNA PROBE  EYE (BH YH),294,0.0%,"","","",""
6760303,"","",LAB10160,ZZZC. TRACHOMATIS  N. GONORRHOEAE  NAAT  THROAT (GH LMW),294,0.0%,"","","",""
6731823,"","",NEU203,EMG NERVE CONDUCTION STUDY (WH ONLY),294,0.0%,"","","",""
7822783,"","",NUR1135,BLOOD DRAW PORT IVAD,294,0.0%,"","","",""
8246213,"","",NUR1324,HEARTMATE II,294,0.0%,"","","",""
2972778,"","",LAB3439,RESPIRATORY SYNCYTIAL VIRUS  RT-PCR  NP     (YH),293,0.0%,"","","",""
9594548,"","",LAB7417,GIARDIA ANTIGEN W RFL TO OVA AND PARASITES     (Q),292,0.0%,"","","",""
2320741,"","",LAB9091,STREP GROUP B COLONIZATION DETECTION  NAA     (L),292,0.0%,"","","",""
5035826,"","",115103,ANTI-INFECTIVE PROPHYLAXIS,292,0.0%,"","","",""
1583846,"","",REF575,AMB REFERRAL TO YMG OPHTHALMOLOGY (YHC),290,0.0%,"","","",""
9805408,"","",IMG2325,US EXTREMITY NON VASCULAR LEFT,290,0.0%,"","","",""
1113977,"","",PRO602,THORACIC ELECTRICAL BIOIMPEDANCE,290,0.0%,"","","",""
2805533,"","",CON274,INPATIENT CONSULT TO THORACIC SURGERY,289,0.0%,"","","",""
7342309,"","",IMG4322,NM QUANTITATIVE LUNG VENTILATION PERFUSION (YH),289,0.0%,"","","",""
4765951,"","",IMG460,NM DMSA RENAL SCAN(YH LM WH),289,0.0%,"","","",""
1733570,"","",IMG4315,INTERVENTIONAL RADIOLOGY PICC (MH),289,0.0%,"","","",""
9279694,"","",IMG5114,US VASCULAR INTRAOP (SRC),289,0.0%,"","","",""
7930301,"","",IMG4257,NR FL GUIDED SI JOINT INJECTION RIGHT (GH YH),287,0.0%,"","","",""
4113871,"","",CON90,IP CONSULT TO PEDIATRIC PSYCHIATRY,287,0.0%,"","","",""
4725563,"","",IMG1127,CT GUIDED NEEDLE BIOPSY UNLISTED(GH BH YH),287,0.0%,"","","",""
5065268,"","",SLP100,SLP ASSISTIVE TECHNOLOGY AUGMENTATIVE ALTERNATIVE COMMUNICATION,287,0.0%,"","","",""
5757028,"","",ECH02,PEDI ECHO 2D LTD CONG ANOMALY W CFI IF INDICATED 3D,287,0.0%,"","","",""
3646618,"","",LAB11460,THINPREP PAP PANEL REFL HPV W MRNA E6 E7  CT NG  TRICH     (Q),286,0.0%,"","","",""
9141172,"","",IVT21,CHANGE PORT-A-CATH NEEDLE,286,0.0%,"","","",""
3439197,"","",IMG4999,US MFM FOLLOW UP FETAL WITH MCA DOPPLER(YH),286,0.0%,"","","",""
1316921,"","",NUR1188,APHERESIS INTERNAL PLASMA EXCHANGE 36514 REJECTION OTHERS,285,0.0%,"","","",""
6576539,"","",LAB4097,B. PERTUSSIS PARA DNA  QUAL PCR      (GH),285,0.0%,"","","",""
