procedure_id,concept_name,concept_id,order_code,order_description,frequency,percentage,domain_id,vocabulary_id,concept_code,concept_class_id
6103571,"Electrocardiogram, routine ECG with at least 12 leads; with interpretation and report",2313814,EKG1,EKG,4848842,8.72%,Procedure,CPT4,93000,CPT4
9823552,No matching concept,0,ADT8,DISCHARGE PATIENT,3255470,5.86%,Metadata,None,No matching concept,Undefined
3332695,No matching concept,0,NUR185,NURSING COMMUNICATION,2625018,4.72%,Metadata,None,No matching concept,Undefined
6244066,"Radiologic examination, chest; 2 views",725069,IMG36,XR CHEST PA AND LATERAL,2367764,4.26%,Procedure,CPT4,71046,CPT4
9817355,No matching concept,0,LAB239,URINE CULTURE,2342505,4.21%,Metadata,None,No matching concept,Undefined
3173834,Conversion of intravenous infusion to saline lock,4174718,IVT11,SALINE LOCK IV,2229807,4.01%,Procedure,SNOMED,425074000,Procedure
4018034,Taking patient vital signs assessment,4254901,NUR490,VITAL SIGNS,2211860,3.98%,Procedure,SNOMED,410188000,Procedure
5258973,"Screening digital breast tomosynthesis, bilateral (List separately in addition to code for primary procedure)",46257421,IMG3729,MAMMO SCREENING TOMO BILATERAL,2058735,3.7%,Procedure,CPT4,77063,CPT4
4180415,No matching concept,0,NUR183,NOTIFY PHYSICIAN LIP TEAM,2058262,3.7%,Metadata,None,No matching concept,Undefined
1635376,Removal of intravenous cannula,4075238,IVT10,REMOVE IV,1941959,3.49%,Procedure,SNOMED,225066003,Procedure
5129166,No matching concept,0,RT195,NASAL OXYGEN- TITRATION (ADULT),1857957,3.34%,Metadata,None,No matching concept,Undefined
5823654,No matching concept,0,COD2,FULL CODE,1623805,2.92%,Metadata,None,No matching concept,Undefined
2705372,No matching concept,0,NUR1130,VITAL SIGNS WITH PULSE OXIMETRY,1555176,2.8%,Metadata,None,No matching concept,Undefined
5465030,No matching concept,0,IMG4994,EXTERNAL IMAGING RESULTS,1459701,2.63%,Metadata,None,No matching concept,Undefined
1418062,"Echocardiography, transthoracic, real-time with image documentation (2D), includes M-mode recording, when performed, complete, with spectral Doppler echocardiography, and with color flow Doppler echocardiography",2313869,ECH10,ECHO 2D COMP W DOPP AND CFI IF IND BUBBLES IMG ENHANC AND OR 3D,1419137,2.55%,Procedure,CPT4,93306,CPT4
5537632,"Blood typing, serologic; antigen screening for compatible unit using patient serum, per unit screened",2212948,LAB276,TYPE AND SCREEN     (BH GH LMW YH),1380815,2.48%,Procedure,CPT4,86904,CPT4
1725236,"Electrocardiogram, routine ECG with at least 12 leads; with interpretation and report",2313814,CVR16,CARDIAC EKG RESULT SCAN,1378168,2.48%,Procedure,CPT4,93000,CPT4
2516016,No matching concept,0,NUR129,ACTIVITY AS TOLERATED,1275541,2.29%,Metadata,None,No matching concept,Undefined
1675875,No matching concept,0,99999,PR NO FEE LOS,1266741,2.28%,Metadata,None,No matching concept,Undefined
4215023,"Infectious agent antigen detection by immunoassay with direct optical (ie, visual) observation; severe acute respiratory syndrome coronavirus 2 (sars-cov-2) (coronavirus disease [covid-19])",759692,LAB10813,SARS COV-2 (COVID-19) RNA,1250614,2.25%,Procedure,CPT4,87811,CPT4
3469242,No matching concept,0,DIET24,DIET REGULAR,1241821,2.23%,Metadata,None,No matching concept,Undefined
2397944,Nil by mouth,4081119,DIET41,DIET NPO EFFECTIVE NOW,1117302,2.01%,Procedure,SNOMED,182923009,Procedure
7358999,Ultrasonography of bilateral breasts,42535066,IMG1073,US BREAST BILATERAL,1022015,1.84%,Procedure,SNOMED,1571000087109,Procedure
9844230,"Screening mammography, bilateral (2-view study of each breast), including computer-aided detection (CAD) when performed",42627987,IMG2208,MAMMO SCREENING,1016314,1.83%,Procedure,CPT4,77067,CPT4
4909352,Seasonal influenza vaccination,44806815,IMM85,INFLUENZA  QUADRIVALENT  PRESERVATIVE FREE,861055,1.55%,Procedure,SNOMED,822851000000102,Procedure
7774405,No matching concept,0,NUR494,MEASURE WEIGHT,834444,1.5%,Metadata,None,No matching concept,Undefined
5422997,Assessment of intake and output measurement,4296798,NUR467,INTAKE AND OUTPUT,834282,1.5%,Procedure,SNOMED,385748006,Procedure
4806404,Use of intermittent pneumatic compression device,44808403,NUR536,PLACE SEQUENTIAL COMPRESSION DEVICE,797236,1.43%,Procedure,SNOMED,829481000000104,Procedure
5851743,No matching concept,0,LABEX10812,SARS COV-2 (COVID-19) RNA (EXTERNAL LAB),788909,1.42%,Metadata,None,No matching concept,Undefined
1113827,No matching concept,0,REF275,AMB REFERRAL TO REHABILITATION SERVICES,777878,1.4%,Metadata,None,No matching concept,Undefined
3542098,"Radiologic examination, chest; single view",725068,IMG34,XR CHEST PA OR AP,756280,1.36%,Procedure,CPT4,71045,CPT4
4478491,Verification routine,4144379,NUR185,A  Y NURSE VERIFICATION,716196,1.29%,Procedure,SNOMED,3390006,Procedure
7203138,"Computed tomography, abdomen and pelvis; with contrast material(s)",40756910,IMG794,CT ABDOMEN PELVIS W IV CONTRAST,711197,1.28%,Procedure,CPT4,74177,CPT4
1700007,Inpatient care management,42537843,ADT1,ADMIT TO INPATIENT,690679,1.24%,Procedure,SNOMED,737481003,Procedure
8252263,No matching concept,0,LAB6408,CYTOLOGY GYN CASES (BH YH),653589,1.18%,Metadata,None,No matching concept,Undefined
6762007,"Infectious agent antigen detection by immunoassay with direct optical (ie, visual) observation; severe acute respiratory syndrome coronavirus 2 (sars-cov-2) (coronavirus disease [covid-19])",759692,LAB10811,SARS COV-2 (COVID-19) RNA- REFERENCE LAB (BH GH LMW Q YH),624900,1.12%,Procedure,CPT4,87811,CPT4
7533861,Surgical procedure,4301351,LAB3671,SURGICAL CASE     (YH),618232,1.11%,Procedure,SNOMED,387713003,Procedure
7861961,"Computed tomography, head or brain; without contrast material",2211327,IMG181,CT HEAD WO IV CONTRAST,603513,1.09%,Procedure,CPT4,70450,CPT4
5990823,"Physical therapy evaluation/treatment, per visit",40217448,PT4,PT EVAL AND TREAT,580514,1.04%,Procedure,HCPCS,Q0086,HCPCS
2239005,Peripheral venous cannula insertion,4049832,IVT3,INSERT PERIPHERAL IV,565702,1.02%,Procedure,SNOMED,233520008,Procedure
1471479,Unlisted surgical pathology procedure,2213321,LAB3675,ZZZSURGICAL PATHOLOGY     (GH),537774,0.97%,Procedure,CPT4,88399,CPT4
5937820,No matching concept,0,LAB462,BLOOD CULTURE   (BH GH L LMW YH),534697,0.96%,Metadata,None,No matching concept,Undefined
3525956,Assessment of risk of venous thromboembolism,40483208,COR25,NO VTE PROPHYLAXIS AT ADMISSION  ON FULL ANTICOAGULATION OR LOW RISK NON-ICU PATIENT,533948,0.96%,Procedure,SNOMED,443749004,Procedure
3835735,Cardiovascular investigation,4078460,CVR17,CARDIAC MISC.  RESULT SCAN,524912,0.94%,Procedure,SNOMED,276341003,Procedure
5960108,Unlisted surgical pathology procedure,2213321,LAB6412,SURGICAL PATHOLOGY     (YH),523681,0.94%,Procedure,CPT4,88399,CPT4
7846497,"Colonoscopy, flexible; diagnostic, including collection of specimen(s) by brushing or washing, when performed (separate procedure)",2109194,GI6,COLONOSCOPY (IMAGES),512889,0.92%,Procedure,CPT4,45378,CPT4
5712141,No matching concept,0,LAB1376,C. TRACHOMATIS   N. GONORRHOEAE  NAAT     (BH GH L LMW YH),507860,0.91%,Metadata,None,No matching concept,Undefined
2532608,No matching concept,0,LAB5421,CYTOLOGY GYN CASES     (YH),484079,0.87%,Metadata,None,No matching concept,Undefined
9313477,"Computed tomography, thorax; without contrast material",2211378,IMG200,CT CHEST WO IV CONTRAST,482165,0.87%,Procedure,CPT4,71250,CPT4
5976801,Ambulating patient,4265052,NUR11,AMBULATE PATIENT,480895,0.87%,Procedure,SNOMED,62013009,Procedure
4514677,No matching concept,0,POSTOP100,DISCONTINUE POSTOP ORDERS,457104,0.82%,Metadata,None,No matching concept,Undefined
7358426,No matching concept,0,NUR616,HEIGHT LENGTH,447120,0.8%,Metadata,None,No matching concept,Undefined
5688905,No matching concept,0,IMGR06,US RESULT SCAN,438432,0.79%,Metadata,None,No matching concept,Undefined
2986902,No matching concept,0,REF25,AMB REFERRAL TO GASTROENTEROLOGY,436072,0.78%,Metadata,None,No matching concept,Undefined
5727032,No matching concept,0,DIET9,DIET CARDIAC,425722,0.77%,Metadata,None,No matching concept,Undefined
4097169,"Magnetic resonance (eg, proton) imaging, brain (including brain stem); without contrast material, followed by contrast material(s) and further sequences",2211353,IMG271,MRI BRAIN W WO IV CONTRAST,421737,0.76%,Procedure,CPT4,70553,CPT4
4246763,No matching concept,0,NUR463,HEIGHT AND WEIGHT,412279,0.74%,Metadata,None,No matching concept,Undefined
1973345,Coronavirus vaccination,4236188,IMM208,COVID-19 VACCINE - PFIZER,401137,0.72%,Procedure,SNOMED,90640007,Procedure
8558010,No matching concept,0,LAB9824,PATHOLOGY (BH YH),399484,0.72%,Metadata,None,No matching concept,Undefined
8238562,No matching concept,0,LAB3666,ZZZCYTOLOGY GYN CASES     (GH),383803,0.69%,Metadata,None,No matching concept,Undefined
6081422,Dual energy X-ray absorptiometry,4086416,IMG2221,DEXA BONE DENSITY,380854,0.69%,Procedure,SNOMED,241686001,Procedure
3618164,Nil by mouth,4081119,DIET40,DIET NPO TIME SPECIFIED,379332,0.68%,Procedure,SNOMED,182923009,Procedure
6255818,"Ultrasound, abdominal, real time with image documentation; complete",2211740,IMG524,US ABDOMEN COMPLETE,376249,0.68%,Procedure,CPT4,76700,CPT4
5175134,Clear liquid diet,763071,DIET13,DIET CLEAR LIQUID,366089,0.66%,Procedure,SNOMED,435741000124103,Procedure
7270243,No matching concept,0,LAB4715,PATHOLOGY CYTOLOGY SCAN,365241,0.66%,Metadata,None,No matching concept,Undefined
1766928,Kidney imaging morphology,2212029,IMG1080,US RENAL,362910,0.65%,Procedure,CPT4,78700,CPT4
2376767,No matching concept,0,NUR1271,PREOP: ACTIVATE YNHH PRE-CALL PROTOCOL (INCLUDES NPO ORDER),353749,0.64%,Metadata,None,No matching concept,Undefined
7060974,No matching concept,0,RT16,INCENTIVE SPIROMETRY RT,350380,0.63%,Metadata,None,No matching concept,Undefined
9231578,No matching concept,0,LAB4802,CG4  I-STAT  VENOUS     (BH YH),342308,0.62%,Metadata,None,No matching concept,Undefined
8163875,No matching concept,0,LAB3584,TROPONIN I (POC)     (LMW YH),336964,0.61%,Metadata,None,No matching concept,Undefined
5767699,"Radiologic examination, spine, lumbosacral; 2 or 3 views",2211397,IMG66,XR LUMBAR SPINE AP AND LATERAL,331268,0.6%,Procedure,CPT4,72100,CPT4
5828433,"Ultrasound, pregnant uterus, real time with image documentation, follow-up (eg, re-evaluation of fetal size by measuring standard growth parameters and amniotic fluid volume, re-evaluation of organ system(s) suspected or confirmed to be abnormal on a prev",2211756,IMG3275,US MFM FOLLOW UP FETAL (PERI ONLY)(GH YH BH NE LM),323083,0.58%,Procedure,CPT4,76816,CPT4
6658886,Radiography of teeth,4119275,IMG4611,DENTAL X-RAY,314618,0.57%,Procedure,SNOMED,22891007,Procedure
6644323,No matching concept,0,CON65,IP CONSULT TO SOCIAL WORK,309920,0.56%,Metadata,None,No matching concept,Undefined
1896789,Adverse drug reaction prevention management,4288387,NUR579,O  DRUG REACTION INSTRUCTIONS,308483,0.55%,Procedure,SNOMED,396081009,Procedure
1481100,No matching concept,0,LAB260,CHLAMYDIA TRACHOMATIS  NAAT (LAB ORDER ONLY) (BH GH L LMW YH),305961,0.55%,Metadata,None,No matching concept,Undefined
9423707,No matching concept,0,LAB1363,NEISSERIA GONORRHEA  NAAT (LAB ORDER ONLY)   (BH GH L LMW YH),305417,0.55%,Metadata,None,No matching concept,Undefined
9779584,No matching concept,0,LAB7059,CHEM8  ISTAT     (GH YH),303529,0.55%,Metadata,None,No matching concept,Undefined
3147770,Procedure involving urinary catheter,4181165,NUR375,DOUBLE LUMEN URINARY CATHETER,303407,0.55%,Procedure,SNOMED,429723008,Procedure
9531876,No matching concept,0,IMGR01,CT RESULT SCAN,300493,0.54%,Metadata,None,No matching concept,Undefined
6064939,"","",ACTV1,ACTIVITY AS TOLERATED-MOBILIZE TO TARGET HIGHEST LEVEL OF MOBILITY(HLM),295031,0.53%,"","","",""
2887335,"Electrocardiogram, routine ECG with at least 12 leads; with interpretation and report",2313814,PRO500,ED EKG,294244,0.53%,Procedure,CPT4,93000,CPT4
4862354,"Tetanus, diphtheria and acellular pertussis vaccination",762510,IMM61,TDAP VACCINE GREATER THAN OR EQUAL TO 7YO IM,292846,0.53%,Procedure,SNOMED,428251000124104,Clinical Finding
1500246,"Insertion of non-indwelling bladder catheter (eg, straight catheterization for residual urine)",2109730,NUR385,STRAIGHT CATH,288023,0.52%,Procedure,CPT4,51701,CPT4
4004377,No matching concept,0,NUR1341,PERFORM CG4  I-STAT  VENOUS  (YH),287950,0.52%,Metadata,None,No matching concept,Undefined
5825098,"Computed tomographic angiography, chest (noncoronary), with contrast material(s), including noncontrast images, if performed, and image postprocessing",2211381,IMG202,CT CHEST W IV CONTRAST,287287,0.52%,Procedure,CPT4,71275,CPT4
7754926,Noninvasive ear or pulse oximetry for oxygen saturation; by continuous overnight monitoring (separate procedure),2314049,NUR586,CONTINUOUS PULSE OXIMETRY,285877,0.51%,Procedure,CPT4,94762,CPT4
9012586,No matching concept,0,ADT7,ZZZRETIREDTRANSFER PATIENT,285352,0.51%,Metadata,None,No matching concept,Undefined
5567919,Occupational therapy assessment,4261887,OT1,OT EVAL AND TREAT,276281,0.5%,Procedure,SNOMED,410155007,Procedure
4843572,No matching concept,0,NUR562,MAINTAIN IV ACCESS,275377,0.5%,Metadata,None,No matching concept,Undefined
4231603,No matching concept,0,REF19,AMB REFERRAL TO DERMATOLOGY,272125,0.49%,Metadata,None,No matching concept,Undefined
5087044,No matching concept,0,LAB895,ABO RH,270699,0.49%,Metadata,None,No matching concept,Undefined
4090740,No matching concept,0,NUR579,L  HOLD PARAMETERS FOR ANC & PLATELETS,268019,0.48%,Metadata,None,No matching concept,Undefined
4328800,"Radiologic examination, abdomen; 1 view",724944,IMG154,XR ABDOMEN AP,266815,0.48%,Procedure,CPT4,74018,CPT4
1747060,"Computed tomography, abdomen and pelvis; without contrast material",40756931,IMG784,CT ABDOMEN PELVIS WO IV CONTRAST,266224,0.48%,Procedure,CPT4,74176,CPT4
1755262,No matching concept,0,LAB8059,PREPARE RBC,266051,0.48%,Metadata,None,No matching concept,Undefined
9505960,"Ultrasound, transvaginal",2211765,IMG547,US NON-OB TRANSVAGINAL,264853,0.48%,Procedure,CPT4,76830,CPT4
9195433,No matching concept,0,IMG1070,US THYROID,264593,0.48%,Metadata,None,No matching concept,Undefined
7944123,No matching concept,0,ADT103,PLACE IN ED OBSERVATION,263583,0.47%,Metadata,None,No matching concept,Undefined
3737036,Elevation of head of bed,4172820,NUR51,ELEVATE HOB,261626,0.47%,Procedure,SNOMED,423171007,Procedure
8289823,Biopsy of skin,4081731,LAB4147,DERMPATH BIOPSY     (YMG),260040,0.47%,Procedure,SNOMED,240977001,Procedure
6651425,No matching concept,0,LABEX10820,SARS COV-2 (COVID-19) AG (EXTERNAL LAB),259898,0.47%,Metadata,None,No matching concept,Undefined
3760536,Surgical pathology procedure,4213297,LAB3673,SURGICAL PATHOLOGY     (BH),258726,0.47%,Procedure,SNOMED,39228008,Procedure
9722634,Isolation of infection contact,4015847,ISO18,SPECIAL RESPIRATORY ISOLATION STATUS,257330,0.46%,Procedure,SNOMED,170499009,Procedure
5275786,No matching concept,0,LAB5193,C. TRACHOMATIS N. GONORRHOEAE RNA BY TMA  (Q),254439,0.46%,Metadata,None,No matching concept,Undefined
5893527,No matching concept,0,PFT45,PULMONARY FUNCTION TEST (YNH AND SRC ONLY),254288,0.46%,Metadata,None,No matching concept,Undefined
4106910,No matching concept,0,REF62,AMB REFERRAL TO ORTHOPEDIC SURGERY,254093,0.46%,Metadata,None,No matching concept,Undefined
1932286,No matching concept,0,DNS1,NUTRITION SUPPLEMENTS,246117,0.44%,Metadata,None,No matching concept,Undefined
3117600,No matching concept,0,REF46,AMB REFERRAL TO NEUROLOGY,239912,0.43%,Metadata,None,No matching concept,Undefined
4957620,Plain radiography,4056681,IMGR03,XRAY RESULT SCAN,238824,0.43%,Procedure,SNOMED,168537006,Procedure
3643756,Noninvasive ear or pulse oximetry for oxygen saturation; single determination,2314047,NUR585,PULSE OXIMETRY,233156,0.42%,Procedure,CPT4,94760,CPT4
4228761,No matching concept,0,NUR162,BED REST,233037,0.42%,Metadata,None,No matching concept,Undefined
3960640,ECG 24 hour recording,40217715,NUR22524,TELEMETRY MONITORING-24 HOURS,232933,0.42%,Procedure,HCPCS,G0005,HCPCS
4866050,No matching concept,0,ISO1,CONTACT ISOLATION STATUS,232514,0.42%,Metadata,None,No matching concept,Undefined
1985894,Use of intermittent pneumatic compression device,44808403,NUR563,MAINTAIN SEQUENTIAL COMPRESSION DEVICE,231732,0.42%,Procedure,SNOMED,829481000000104,Procedure
7615619,Cold pack treatment,4042701,NUR397,ICE COLD COMPRESS,231639,0.42%,Procedure,SNOMED,229585002,Procedure
4042596,"Dual-energy X-ray absorptiometry (DXA), bone density study, 1 or more sites; axial skeleton (eg, hips, pelvis, spine)",2211826,IMG1452,DEXA BONE DENSITY SPINE AND HIP,231172,0.42%,Procedure,CPT4,77080,CPT4
5206236,"Magnetic resonance (eg, proton) imaging, brain (including brain stem); without contrast material",2211351,IMG269,MRI BRAIN WO IV CONTRAST,229902,0.41%,Procedure,CPT4,70551,CPT4
5774613,No matching concept,0,NUR1350,PERFORM CHEM8  ISTAT (YH),229258,0.41%,Metadata,None,No matching concept,Undefined
2173348,No matching concept,0,ADT30,ZZZRETIREDYNH ED ADMIT TO MEDICAL SERVICE,225686,0.41%,Metadata,None,No matching concept,Undefined
6059702,No matching concept,0,NUR225,TELEMETRY MONITORING,222715,0.4%,Metadata,None,No matching concept,Undefined
4171295,No matching concept,0,NUR26522,POST FOLEY PROTOCOL,220472,0.4%,Metadata,None,No matching concept,Undefined
9556290,"CT of thorax, abdomen and pelvis with contrast",4200610,IMG1428,CT CHEST ABDOMEN PELVIS W IV CONTRAST,219928,0.4%,Procedure,SNOMED,433761009,Procedure
6190426,"Magnetic resonance (eg, proton) imaging, spinal canal and contents, lumbar; without contrast material",2211414,IMG283,MRI LUMBAR SPINE WO IV CONTRAST,217816,0.39%,Procedure,CPT4,72148,CPT4
9617921,Transfusion of red blood cells,4022173,NUR619,TRANSFUSE RED BLOOD CELLS,217405,0.39%,Procedure,SNOMED,116863004,Procedure
2835658,No matching concept,0,NUR1460,DOCUMENT INTAKE OF SUPPLEMENT,214098,0.39%,Metadata,None,No matching concept,Undefined
2709401,No matching concept,0,NUR1351,PERFORM POCT TROPONIN (YH),213487,0.38%,Metadata,None,No matching concept,Undefined
4599659,No matching concept,0,NUR579,QQQ  COMMUNICATION TO NURSING,211743,0.38%,Metadata,None,No matching concept,Undefined
7990258,Administration of vaccine,44791414,IMM2131,COVID-19 PFIZER 2ND DOSE GENERIC VACCINE ORDER,211673,0.38%,Procedure,SNOMED,283511000000105,Procedure
9075105,Fetal non-stress test,2110284,OBO15,FETAL NONSTRESS TEST,211428,0.38%,Procedure,CPT4,59025,CPT4
7987754,"Clostridium difficile toxin(s) antigen detection by immunoassay technique, stool, qualitative, multiple-step method",709858,LAB7877,C. DIFFICILE ASSAY,211091,0.38%,Procedure,CPT4,0107U,CPT4
6208324,Continuous ECG monitoring,4141651,NUR22549,TELEMETRY MONITORING-CONTINUOUS (ORDER DOES NOT AUTO-EXPIRE),209566,0.38%,Procedure,SNOMED,266706003,Procedure
4422112,X-ray skeletal survey of chest with oblique ribs,46286682,IMG2231,XR CHEST OBLIQUES,208599,0.38%,Procedure,SNOMED,989481000000102,Procedure
2086332,Diagnostic digital breast tomosynthesis; bilateral,46257521,IMG3732,MAMMO DIAGNOSTIC TOMO BILATERAL,203424,0.37%,Procedure,CPT4,77062,CPT4
2955174,"Blood typing, serologic; Rh phenotyping, complete",2212950,LAB8032,TYPE AND RH RECHECK     (BH GH LMW YH),202392,0.36%,Procedure,CPT4,86906,CPT4
5937135,24 Hour ECG,4098508,CAR02,HOLTER MONITOR - 24 HOUR,198401,0.36%,Procedure,SNOMED,252417001,Procedure
6430691,No matching concept,0,LAB228,THROAT CULTURE     (Q),197764,0.36%,Metadata,None,No matching concept,Undefined
5244732,Colonoscopy,4249893,HM4,HM COLONOSCOPY,197167,0.35%,Procedure,SNOMED,73761001,Procedure
7104002,No matching concept,0,NUR1180,ADMIT TO PROGRAM,196522,0.35%,Metadata,None,No matching concept,Undefined
7584865,"",423558004,NUR475,NEUROVASCULAR CHECKS,190195,0.34%,"","","",""
6381165,No matching concept,0,NUR1261,DISCHARGE ACTIVITY,190028,0.34%,Metadata,None,No matching concept,Undefined
8531154,Administration of pneumococcal 13-valent conjugate vaccine,37208053,IMM54,PNEUMOCOCCAL CONJUGATE VACCINE 13-VALANT LESS THAN 5YO IM,190021,0.34%,Procedure,SNOMED,459981000124107,Procedure
4513854,Consistent carbohydrate diet,763064,DIET122,DIET CARDIAC CONSISTENT CARBOHYDRATE,189849,0.34%,Procedure,SNOMED,435651000124106,Procedure
1207368,No matching concept,0,LAB3221,LOWER RESPIRATORY CULTURE     (BH GH L LMW YH),189669,0.34%,Metadata,None,No matching concept,Undefined
7926906,Duplex scan of extremity veins including responses to compression and other maneuvers; complete bilateral study,2313990,IMG1212,US DUPLEX LOWER EXTREMITY VENOUS BILATERAL,189165,0.34%,Procedure,CPT4,93970,CPT4
5215036,No matching concept,0,NUR3248,INITIATE PRE-OP NURSING STANDING ORDERS ADULT,188240,0.34%,Metadata,None,No matching concept,Undefined
3494027,No matching concept,0,CON34,IP CONSULT TO NUTRITION SERVICES,187036,0.34%,Metadata,None,No matching concept,Undefined
1466624,Esophagogastroduodenoscopy,4294382,GI47,UPPER  ENDOSCOPY,185798,0.33%,Procedure,SNOMED,76009000,Procedure
1964010,"Cardiovascular stress test using maximal or submaximal treadmill or bicycle exercise, continuous electrocardiographic monitoring, and/or pharmacological stress; tracing only, without interpretation and report",2313821,CAR141,EXERCISE STRESS TEST  NO IMAGING,185489,0.33%,Procedure,CPT4,93017,CPT4
7238730,Mammography,4324693,IMGR04,MAMMOGRAPHY RESULT SCAN,182764,0.33%,Procedure,SNOMED,71651007,Procedure
4536971,Pain assessment,4021323,NUR985,PAIN ASSESSMENT,181642,0.33%,Procedure,SNOMED,225399009,Procedure
6721524,No matching concept,0,NUR1260,CALL MD,180986,0.33%,Metadata,None,No matching concept,Undefined
7998323,"","",APPT22,PROVIDER RETURN,180952,0.33%,"","","",""
9990336,No matching concept,0,NUR401,DRESSING CHECK,180394,0.32%,Metadata,None,No matching concept,Undefined
8877914,No matching concept,0,ADT101,ED ADMIT TO INPATIENT,180145,0.32%,Metadata,None,No matching concept,Undefined
4711827,No matching concept,0,PRE5,FALL PRECAUTIONS,178525,0.32%,Metadata,None,No matching concept,Undefined
6335478,"Referral to ear, nose and throat service",4079634,REF23,AMB REFERRAL TO ENT,177980,0.32%,Observation,SNOMED,183544005,Procedure
6049503,No matching concept,0,NUR1272,PREOP: ACTIVATE YNHH PROCEDURAL ADMISSION PROTOCOL,177504,0.32%,Metadata,None,No matching concept,Undefined
2691649,Duplex scan of extracranial arteries; complete bilateral study,2313975,IMG1202,US DUPLEX CAROTID BILATERAL COMPLETE,176993,0.32%,Procedure,CPT4,93880,CPT4
3665663,No matching concept,0,REF106,AMB REFERRAL TO UROLOGY,175627,0.32%,Metadata,None,No matching concept,Undefined
8307336,No matching concept,0,NUR1222,PERFORM CHG BATH,175085,0.31%,Metadata,None,No matching concept,Undefined
3869507,"Ultrasonography of abdomen, right upper quadrant and epigastrium",42535580,IMG3918,US RIGHT UPPER QUADRANT (BH GH YH YHC LM WH),174564,0.31%,Procedure,SNOMED,426701000119108,Procedure
3396247,No matching concept,0,REF34,AMB REFERRAL TO HOME HEALTH,173386,0.31%,Metadata,None,No matching concept,Undefined
6331755,No matching concept,0,NUR1262,DISCHARGE DIET,173259,0.31%,Metadata,None,No matching concept,Undefined
8605913,X-ray of right foot,4144465,IMG150,XR FOOT RIGHT AP LATERAL AND OBLIQUE,172969,0.31%,Procedure,SNOMED,426311001,Procedure
4414291,No matching concept,0,ADT108,TRANSFER PATIENT,172795,0.31%,Metadata,None,No matching concept,Undefined
4806641,Oxygen administration by nasal cannula,4155151,RT51,NASAL CANNULA OXYGEN- NO TITRATION (ADULT),172557,0.31%,Procedure,SNOMED,371907003,Procedure
2887028,CT of head and cervical spine with contrast,37016642,IMG2828,CT HEAD CERVICAL SPINE WO IV CONTRAST (BH YH YHC),169709,0.31%,Procedure,SNOMED,712727001,Procedure
5900520,Coronavirus vaccination,4236188,IMM207,COVID-19 MODERNA  12 YRS+  0.5ML,169147,0.3%,Procedure,SNOMED,90640007,Procedure
2809063,Consistent carbohydrate diet,763064,DIET16,DIET CONSISTENT CARBOHYDRATE,169052,0.3%,Procedure,SNOMED,435651000124106,Procedure
3070436,No matching concept,0,COD3,NO CODE,168091,0.3%,Metadata,None,No matching concept,Undefined
2309085,"Ultrasound, pregnant uterus, real time with image documentation, fetal and maternal evaluation, after first trimester (> or = 14 weeks 0 days), transabdominal approach; single or first gestation",2211749,IMG3278,US MFM PREG >14 WKS DETAIL SINGLE (PERI ONLY)(GH YH BH NE LM),165908,0.3%,Procedure,CPT4,76805,CPT4
2056870,No matching concept,0,REF12,AMB REFERRAL TO CARDIOVASCULAR DISEASE,165184,0.3%,Metadata,None,No matching concept,Undefined
1288058,Diabetic retinal eye exam,36716226,HM6,HM DIABETES EYE EXAM,164841,0.3%,Procedure,SNOMED,722161008,Procedure
5801539,Continuous ECG monitoring,4141651,NUR22548,TELEMETRY MONITORING-48 HOURS,163561,0.29%,Procedure,SNOMED,266706003,Procedure
9627731,"Computed tomographic angiography, chest (noncoronary), with contrast material(s), including noncontrast images, if performed, and image postprocessing",2211381,IMG3904,CTA PE (CHEST),163206,0.29%,Procedure,CPT4,71275,CPT4
8349001,"Interrogation device evaluation (in person) with analysis, review and report, includes connection, recording and disconnection per patient encounter, implantable cardiac contractility modulation system",42628040,CVR15,CARDIAC DEVICE INTERROGATION RESULT SCAN,162569,0.29%,Procedure,CPT4,0418T,CPT4
1546543,X-ray of left foot,4140442,IMG149,XR FOOT LEFT AP LATERAL AND OBLIQUE,162494,0.29%,Procedure,SNOMED,426908009,Procedure
2700406,"Myocardial perfusion imaging, tomographic (SPECT) (including attenuation correction, qualitative or quantitative wall motion, ejection fraction by first pass or gated technique, additional quantification, when performed); multiple studies, at rest and/or",40756833,NMC2996,NM MYOCARDIAL PERFUSION SPECT (STRESS AND REST) WITH REGADENOSON,161508,0.29%,Procedure,CPT4,78452,CPT4
6554204,Magnetic resonance imaging,4013636,IMGR02,MRI RESULT SCAN,161340,0.29%,Procedure,SNOMED,113091000,Procedure
7333131,No matching concept,0,LAB5426,SURGICAL CASE     (YH),158926,0.29%,Metadata,None,No matching concept,Undefined
